,Unnamed: 0,archiveDate,Urls,headlines,team,total_score
1315,2111.0,2018-12-18,http://web.archive.org/web/20181218122751/http://www.espn.com/nfl/,Kobe's message hits home with rising Browns,Cleveland Browns,0.9925302248448132
1316,2112.0,2018-12-18,http://web.archive.org/web/20181218153253/https://www.nfl.com/news,Updated draft order: 49ers lose hold of No. 1 pick; plus needs for every team,San Francisco 49ers,-0.6739275716245174
1317,2113.0,2018-12-18,http://web.archive.org/web/20181218153253/https://www.nfl.com/news,Bob Wylie stars as Santa in Browns holiday video,Cleveland Browns,0.6336284279823303
1318,2114.0,2018-12-18,http://web.archive.org/web/20181218153253/https://www.nfl.com/news,TRUE OR FALSE: Chargers NFL's most complete team? Bears best in NFC?,Los Angeles Chargers,-0.0085228942334651
1319,2115.0,2018-12-18,http://web.archive.org/web/20181218153253/https://www.nfl.com/news,Foles assumes familiar role heads season-saving win for Eagles,Philadelphia Eagles,0.992313795723021
1320,2116.0,2018-12-18,http://web.archive.org/web/20181218153253/https://www.nfl.com/news,'Rejuvenated' Colts hand Cowboys first shutout in 15 years,Indianapolis Colts,0.9889540523290634
1321,2117.0,2018-12-19,http://web.archive.org/web/20181219054211/https://www.nfl.com/news,Backup for Gurley: Vet RB Anderson joining Rams,Los Angeles Rams,0.7287847623229027
1322,2118.0,2018-12-19,http://web.archive.org/web/20181219130003/http://www.espn.com/nfl/,Redskins' Nicholson arrested on assault charge,Washington Football Team,-0.7859388939104974
1323,2119.0,2018-12-19,http://web.archive.org/web/20181219130003/http://www.espn.com/nfl/,Rams add RB Anderson for depth behind Gurley,Los Angeles Rams,0.8260832000523806
1324,2120.0,2018-12-19,http://web.archive.org/web/20181219130003/http://www.espn.com/nfl/,Packers put Aaron Jones on IR with knee injury,Green Bay Packers,-0.9686450557783246
1325,2121.0,2018-12-20,http://web.archive.org/web/20181220032822/http://www.nfl.com/news,Ranking the top five O-lines of Week 15: Can anyone stop Titans' ground attack?,Tennessee Titans,0.5426083244383335
1326,2122.0,2018-12-20,http://web.archive.org/web/20181220121329/http://www.espn.com/nfl/,Source: Panthers shutting down Cam Newton,Carolina Panthers,-0.6721725165843964
1327,2123.0,2018-12-20,http://web.archive.org/web/20181220121329/http://www.espn.com/nfl/,'Heartbroken' Leonard eyes 40 tackles vs. Giants,New York Giants,-0.9806046050507576
1328,2124.0,2018-12-20,http://web.archive.org/web/20181220121329/http://www.espn.com/nfl/,Cards claim WR Cooper off waivers from Rams,Arizona Cardinals,0.750247098505497
1329,2125.0,2018-12-20,http://web.archive.org/web/20181220121329/http://www.espn.com/nfl/,Ex-Lions WR Young released from Calif. prison,Detroit Lions,0.4957638680934906
1330,2126.0,2018-12-20,http://web.archive.org/web/20181220121329/http://www.espn.com/nfl/,Rodgers to play vs. Jets cites role as a leader,New York Jets,0.9671225743368268
1331,2127.0,2018-12-21,http://web.archive.org/web/20181221053234/http://www.espn.com/nfl/,Patriots' Gordon suspended indefinitely by NFL,New England Patriots,-0.9627042189240456
1332,2128.0,2018-12-21,http://web.archive.org/web/20181221053234/http://www.espn.com/nfl/,Eagle builds locker-room shrine to Nick Foles,Philadelphia Eagles,0.6622146563604474
1333,2129.0,2018-12-21,http://web.archive.org/web/20181221053234/http://www.espn.com/nfl/,Gruden hopes Raiders stint can 'restart' Peterman,Las Vegas Raiders,0.4283185601234436
1334,2130.0,2018-12-21,http://web.archive.org/web/20181221053234/http://www.espn.com/nfl/,Browns' Wylie star of 'Hard Knocks' breaks ankle,Cleveland Browns,-0.8768634460866451
1335,2131.0,2018-12-21,http://web.archive.org/web/20181221053234/http://www.espn.com/nfl/,Saints DE Jordan: Big Ben not in top 5 this era,New Orleans Saints,-0.9086229726672173
1336,2132.0,2018-12-21,http://web.archive.org/web/20181221075644/https://www.nfl.com/news,Week 16 predictions: Will Mahomes tame the 12s? Can Steelers upend Saints?,Pittsburgh Steelers,0.2201633639633655
1337,2133.0,2018-12-21,http://web.archive.org/web/20181221075644/https://www.nfl.com/news,DDFP: Cam Heyward; Whitney Mercilus; Rams' struggles,Los Angeles Rams,-0.9960363074205816
1338,2134.0,2018-12-22,http://web.archive.org/web/20181222142216/http://www.espn.com/nfl/,Raiders look at S.F. for '19 but 'all options open',Las Vegas Raiders,0.3775196000933647
1339,2135.0,2018-12-22,http://web.archive.org/web/20181222142216/http://www.espn.com/nfl/,Ravens end speculation will stick with Harbaugh,Baltimore Ravens,-0.1988130509853363
1340,2136.0,2018-12-22,http://web.archive.org/web/20181222142216/http://www.espn.com/nfl/,Rams' Gurley to be game-time decision vs. Cards,Los Angeles Rams,-0.2213204205036163
1341,2137.0,2018-12-22,http://web.archive.org/web/20181222142216/http://www.espn.com/nfl/,Panthers' Reid: Fined $20K for sideline tackle,Carolina Panthers,-0.9759726221673192
1342,2138.0,2018-12-22,http://web.archive.org/web/20181222142216/http://www.espn.com/nfl/,Steelers to be without Conner for third straight,Pittsburgh Steelers,-0.9576918762177228
1343,2139.0,2018-12-22,http://web.archive.org/web/20181222171709/https://www.nfl.com/news,What's wrong with Jared Goff? Plus why Pats can win AFC without Gordon,New England Patriots,-0.6027035741135478
1344,2140.0,2018-12-22,http://web.archive.org/web/20181222171709/https://www.nfl.com/news,Patriots' offensive problems stem from average O-line play,New England Patriots,-0.9676340396981686
1345,2141.0,2018-12-22,http://web.archive.org/web/20181222171709/https://www.nfl.com/news,Yes it's happening: The AFC no longer belongs to the Patriots,New England Patriots,0.9647070383653044
1346,2142.0,2018-12-23,http://web.archive.org/web/20181223090611/http://www.espn.com/nfl/,Titans' Lewan claims Norman tried to hurt Henry,Tennessee Titans,-0.9509673519060016
1347,2143.0,2018-12-23,http://web.archive.org/web/20181223090611/http://www.espn.com/nfl/,Swearinger rips Redskins DC's playcalling in loss,Washington Football Team,-0.9964106946717948
1348,2144.0,2018-12-23,http://web.archive.org/web/20181223090611/http://www.espn.com/nfl/,Gabbert replaces injured Mariota in Titans' win,Tennessee Titans,0.8674329463392496
1349,2145.0,2018-12-23,http://web.archive.org/web/20181223090611/http://www.espn.com/nfl/,Ginn activated as Saints look to lock up 1-seed,New Orleans Saints,0.9857242172583938
1350,2146.0,2018-12-23,http://web.archive.org/web/20181223174949/https://www.nfl.com/news,Jaguars Panthers expected to keep head coaches,Jacksonville Jaguars,0.3279584348201751
1351,2147.0,2018-12-23,http://web.archive.org/web/20181223174949/https://www.nfl.com/news,Fitzgerald on Steve Wilks: Cards all want him back,Arizona Cardinals,0.6106112748384476
1352,2148.0,2018-12-23,http://web.archive.org/web/20181223174949/https://www.nfl.com/news,Silver: Jackson making Ravens playoff contenders,Baltimore Ravens,0.9984057343390303
1353,2150.0,2018-12-24,http://web.archive.org/web/20181224063112/http://www.espn.com/nfl/,Panthers' McCaffrey sets NFL mark beats dad,Carolina Panthers,0.8585886731743813
1354,2151.0,2018-12-24,http://web.archive.org/web/20181224063112/http://www.espn.com/nfl/,Seahawks clinch wild-card berth after 0-2 start,Seattle Seahawks,0.4702254831790924
1355,2152.0,2018-12-24,http://web.archive.org/web/20181224063112/http://www.espn.com/nfl/,Bears Niners brawl after late hit on Trubisky,Chicago Bears,-0.7595545537769794
1356,2153.0,2018-12-24,http://web.archive.org/web/20181224063112/http://www.espn.com/nfl/,Bowles: Jets played 2 teams -- Packers and refs,New York Jets,-0.2295883744955063
1357,2154.0,2018-12-24,http://web.archive.org/web/20181224113851/http://www.nfl.com:80/news,Steelers' playoff hopes grim after latest missed opportunity,Pittsburgh Steelers,-0.9877492485102266
1358,2155.0,2018-12-24,http://web.archive.org/web/20181224113851/http://www.nfl.com:80/news,Still alive! Eagles eye wild-card spot after last-second win,Philadelphia Eagles,0.9674759088084102
1359,2159.0,2018-12-25,http://web.archive.org/web/20181225081102/http://www.espn.com/nfl/,Seahawks sign Carroll to extension through '21,Seattle Seahawks,0.973073654808104
1360,2160.0,2018-12-25,http://web.archive.org/web/20181225081102/http://www.espn.com/nfl/,RB Lindsay exits Broncos' loss with wrist injury,Denver Broncos,-0.8833597507327795
1361,2161.0,2018-12-25,http://web.archive.org/web/20181225081102/http://www.espn.com/nfl/,Sources: Titans lose Pro Bowler Casey for finale,Tennessee Titans,-0.9577810168266296
1362,2162.0,2018-12-25,http://web.archive.org/web/20181225081102/http://www.espn.com/nfl/,Swearinger loses job after bashing Redskins' DC,Washington Football Team,-0.993943601642968
1363,2163.0,2018-12-25,http://web.archive.org/web/20181225142618/http://www.nfl.com:80/news,Updated draft order: Cards can clinch top pick; plus needs for every team,Arizona Cardinals,0.3711387999355793
1364,2164.0,2018-12-25,http://web.archive.org/web/20181225142618/http://www.nfl.com:80/news,The Debrief: How the Playoff Picture dominoes could fall (and the Steelers' last hope),Pittsburgh Steelers,-0.0288560278713703
1365,2167.0,2018-12-26,http://web.archive.org/web/20181226002133/http://www.espn.com/nfl/,Cardinals add ex-Redskin Swearinger off waivers,Arizona Cardinals,0.7305957973003387
1366,2168.0,2018-12-26,http://web.archive.org/web/20181226201054/https://www.nfl.com/news,Ranking the top five O-lines of Week 16: Ravens meshing at the right time,Baltimore Ravens,0.9898897500243038
1367,2171.0,2018-12-28,http://web.archive.org/web/20181228075658/https://www.nfl.com/news,Week 17 predictions: Titans or Colts in de facto playoff game?,Tennessee Titans,0.2003621347248554
1368,2172.0,2018-12-28,http://web.archive.org/web/20181228103223/http://www.espn.com/nfl/,Sources: Bucs WR Jackson wants out of Tampa,Tampa Bay Buccaneers,-0.7893174290657043
1369,2173.0,2018-12-28,http://web.archive.org/web/20181228103223/http://www.espn.com/nfl/,Landry gets Cleveland-Baltimore history lesson,Cleveland Browns,-0.0289495252072811
1370,2174.0,2018-12-28,http://web.archive.org/web/20181228103223/http://www.espn.com/nfl/,Chiefs give Hunt's replacement Williams new deal,Kansas City Chiefs,0.6435494124889374
1371,2175.0,2018-12-28,http://web.archive.org/web/20181228103223/http://www.espn.com/nfl/,Stafford stumps to stay with Lions for career,Detroit Lions,0.0613425970077514
1372,2176.0,2018-12-28,http://web.archive.org/web/20181228103223/http://www.espn.com/nfl/,Source: Freak injury sent Jets' Tomlinson to IR,New York Jets,-0.940942507237196
1373,2177.0,2018-12-29,http://web.archive.org/web/20181229080558/http://www.nfl.com:80/news,Ravens weren't first team to expose Chargers' O-line weaknesses,Baltimore Ravens,-0.0104107558727264
1374,2178.0,2018-12-29,http://web.archive.org/web/20181229080558/http://www.nfl.com:80/news,Time to Cook: Vikings RB among notable figures in the Week 17 spotlight,Minnesota Vikings,0.620146771427244
1375,2179.0,2018-12-29,http://web.archive.org/web/20181229080558/http://www.nfl.com:80/news,How in the world can the Vikings stop Mack? Plus C.J. finds a home,Minnesota Vikings,-0.5551592297852039
1376,2180.0,2018-12-29,http://web.archive.org/web/20181229105900/http://www.espn.com/nfl/,Even on IR Bengals' Eifert still worries Steelers,Cincinnati Bengals,-0.1785431134048849
1377,2181.0,2018-12-29,http://web.archive.org/web/20181229105900/http://www.espn.com/nfl/,Rams rule out RB Gurley S Joyner vs. 49ers,Los Angeles Rams,-0.7622784078121185
1378,2182.0,2018-12-29,http://web.archive.org/web/20181229105900/http://www.espn.com/nfl/,Rivera: 'Positive' talks about return to Panthers,Carolina Panthers,0.9976830177474768
1379,2183.0,2018-12-29,http://web.archive.org/web/20181229105900/http://www.espn.com/nfl/,Season over: OBJ to miss 4th straight for Giants,New York Giants,-0.9915050270501524
1380,2184.0,2018-12-29,http://web.archive.org/web/20181229105900/http://www.espn.com/nfl/,Sources: Jets ink WR Enunwa to $36M extension,New York Jets,0.9288911260664464
1381,2185.0,2018-12-30,http://web.archive.org/web/20181230051300/http://www.nfl.com/news,Adam Gase's status up in the air with Dolphins,Miami Dolphins,-0.6842972598969936
1382,2186.0,2018-12-30,http://web.archive.org/web/20181230051300/http://www.nfl.com/news,Wilks' return to Cardinals would be major surprise,Arizona Cardinals,-0.7093331068754196
1383,2190.0,2018-12-30,http://web.archive.org/web/20181230081759/http://www.espn.com/nfl/,Source: Colts' Ebron Hilton expected to play,Indianapolis Colts,0.9390319855883718
1384,2191.0,2018-12-30,http://web.archive.org/web/20181230081759/http://www.espn.com/nfl/,Bears activate Pro Bowl guard Long from IR,Chicago Bears,0.8832788839936256
1385,2193.0,2018-12-31,http://web.archive.org/web/20181231125449/http://www.espn.com/nfl/,Jets fire coach Bowles after third losing season,New York Jets,-0.9762601796537638
1386,2194.0,2018-12-31,http://web.archive.org/web/20181231125449/http://www.espn.com/nfl/,Cardinals lose at buzzer will pick No. 1 overall,Arizona Cardinals,-0.9090522453188896
1387,2195.0,2018-12-31,http://web.archive.org/web/20181231125449/http://www.espn.com/nfl/,Bucs part ways with Koetter following 3 seasons,Tampa Bay Buccaneers,-0.8456000089645386
1388,2196.0,2018-12-31,http://web.archive.org/web/20181231125449/http://www.espn.com/nfl/,Saints installed as favorites for Super Bowl title,New Orleans Saints,0.9770592073909938
1389,2197.0,2018-12-31,http://web.archive.org/web/20181231125449/http://www.espn.com/nfl/,Source: Jags void Fournette contract guarantees,Jacksonville Jaguars,-0.4905681014060974
1390,2198.0,2018-12-31,http://web.archive.org/web/20181231125449/http://www.espn.com/nfl/,Ravens' Weddle to share $1M for making playoffs,Baltimore Ravens,0.9441476687788964
1391,2199.0,2018-12-31,http://web.archive.org/web/20181231221623/https://www.nfl.com/news,Titans LB Brian Orakpo retiring after 10 seasons,Tennessee Titans,-0.415701687335968
1392,2200.0,2018-12-31,http://web.archive.org/web/20181231221623/https://www.nfl.com/news,Raiders 49ers named as Senior Bowl coaching staffs,Las Vegas Raiders,0.6818704754114151
1393,2201.0,2018-12-31,http://web.archive.org/web/20181231221623/https://www.nfl.com/news,Updated draft order: Cardinals own top pick; Giants to take QB?,Arizona Cardinals,0.1375753283500671
1394,2202.0,2018-12-31,http://web.archive.org/web/20181231221623/https://www.nfl.com/news,Adam Gase's future with Dolphins remains in doubt,Miami Dolphins,-0.9764109530951828
1395,2206.0,2019-01-02,http://web.archive.org/web/20190102012747/http://www.espn.com/nfl/,Cowboys' Elliott raring to face Seattle 'right now',Dallas Cowboys,0.9451269209384918
1396,2207.0,2019-01-02,http://web.archive.org/web/20190102012747/http://www.espn.com/nfl/,Big Ben says he has no issue with WR Brown,Cleveland Browns,0.7823545709252357
1397,2208.0,2019-01-02,http://web.archive.org/web/20190102012747/http://www.espn.com/nfl/,Seahawks put safety Hill on IR with hip fracture,Seattle Seahawks,-0.989367357455194
1398,2209.0,2019-01-02,http://web.archive.org/web/20190102012747/http://www.espn.com/nfl/,Reports: Jaguars fire RB coach following drama,Jacksonville Jaguars,-0.979487993521616
1399,2210.0,2019-01-02,http://web.archive.org/web/20190102012747/http://www.espn.com/nfl/,Mayock: Timing was right to finally join Raiders,Las Vegas Raiders,0.994792924495414
1400,2213.0,2019-01-03,http://web.archive.org/web/20190103004143/https://www.nfl.com/news,Ranking the top five O-lines of Week 17: Colts front owns de facto playoff game,Indianapolis Colts,0.941649732645601
1401,2214.0,2019-01-03,http://web.archive.org/web/20190103012414/http://www.espn.com/nfl/,Giants GM seems committed to OBJ iffy on Eli,New York Giants,0.0139908194541931
1402,2215.0,2019-01-03,http://web.archive.org/web/20190103012414/http://www.espn.com/nfl/,Colts center Kelly expects to play vs. Texans,Indianapolis Colts,0.887725468724966
1403,2216.0,2019-01-03,http://web.archive.org/web/20190103012414/http://www.espn.com/nfl/,Lions OC Cooter out after subpar '18 season,Detroit Lions,-0.997282425814774
1404,2218.0,2019-01-04,http://web.archive.org/web/20190104042606/http://www.espn.com/nfl/,Vikings' Zimmer: Lame-duck status 'no problem',Minnesota Vikings,0.0
1405,2219.0,2019-01-04,http://web.archive.org/web/20190104042606/http://www.espn.com/nfl/,Seahawks CB Griffin likely to play despite ankle,Seattle Seahawks,0.8444339781999588
1406,2220.0,2019-01-04,http://web.archive.org/web/20190104042606/http://www.espn.com/nfl/,Steelers' Tomlin: Brown hasn't requested trade,Pittsburgh Steelers,0.071302592754364
1407,2221.0,2019-01-04,http://web.archive.org/web/20190104042606/http://www.espn.com/nfl/,Best bets for Seahawks-Cowboys,Seattle Seahawks,0.8798185474006459
1408,2222.0,2019-01-04,http://web.archive.org/web/20190104053922/http://www.nfl.com/news,Five teams that should trade for Antonio Brown; plus ranking the playoff QBs,Cleveland Browns,0.5859296454582363
1409,2223.0,2019-01-04,http://web.archive.org/web/20190104053922/http://www.nfl.com/news,Strength area of concern for each NFC playoff team: Will passing game limit Bears?,Chicago Bears,-0.0118825001409277
1410,2224.0,2019-01-05,http://web.archive.org/web/20190105005419/http://www.nfl.com:80/news,Will Eagles' championship O-line pedigree outshine Bears?,Philadelphia Eagles,0.5850555789656937
1411,2225.0,2019-01-05,http://web.archive.org/web/20190105104645/http://www.espn.com/nfl/,Source: Texans WR Coutee expected to face Indy,Houston Texans,0.7071589082479477
1412,2226.0,2019-01-05,http://web.archive.org/web/20190105104645/http://www.espn.com/nfl/,Bucs' Grimes says he feels disrespected by team,Tampa Bay Buccaneers,-0.9978463536826894
1413,2227.0,2019-01-05,http://web.archive.org/web/20190105104645/http://www.espn.com/nfl/,Arizona hires ex-NFL RB Murray as assistant,Arizona Cardinals,0.8644454479217529
1414,2228.0,2019-01-05,http://web.archive.org/web/20190105104645/http://www.espn.com/nfl/,Steelers won't renew LB coach Porter's contract,Pittsburgh Steelers,-0.8278816342353821
1415,2229.0,2019-01-06,http://web.archive.org/web/20190106010912/http://www.espn.com/nfl/,Sources: Steelers' Munchak interested in Broncos,Pittsburgh Steelers,0.6457854211330414
1416,2230.0,2019-01-06,http://web.archive.org/web/20190106010912/http://www.espn.com/nfl/,49ers' Exum fined $53K for hit on Rams' Woods,San Francisco 49ers,-0.7429018765687943
1417,2233.0,2019-01-06,http://web.archive.org/web/20190106021104/https://www.nfl.com/news,Ballard Colts knew what they had in Frank Reich,Indianapolis Colts,0.9448304884135724
1418,2234.0,2019-01-06,http://web.archive.org/web/20190106021104/https://www.nfl.com/news,Steelers expected to hear trade offers for Brown,Pittsburgh Steelers,0.3961423337459564
1419,2236.0,2019-01-07,http://web.archive.org/web/20190107002859/http://www.espn.com/nfl/,Sources: Broncos block teams from hiring Kubiak,Denver Broncos,-0.9544755779206752
1420,2237.0,2019-01-07,http://web.archive.org/web/20190107002859/http://www.espn.com/nfl/,Sources: Eagles eye fix to give Foles $1M bonus,Philadelphia Eagles,0.7215090300887823
1421,2238.0,2019-01-07,http://web.archive.org/web/20190107002859/http://www.espn.com/nfl/,Sources: Ravens Harbaugh still talking new deal,Baltimore Ravens,0.3909805715084076
1422,2239.0,2019-01-07,http://web.archive.org/web/20190107060010/http://www.nfl.com:80/news,Nick Foles does it again in road playoff win over Bears,Chicago Bears,0.983941812068224
1423,2240.0,2019-01-07,http://web.archive.org/web/20190107060010/http://www.nfl.com:80/news,Kwamie Lassiter former Cardinals safety dead at 49,Arizona Cardinals,-0.6885696351528168
1424,2241.0,2019-01-07,http://web.archive.org/web/20190107060010/http://www.nfl.com:80/news,Battista: Ravens face pivotal offseason after playoff loss,Baltimore Ravens,-0.9290913296863436
1425,2242.0,2019-01-07,http://web.archive.org/web/20190107060010/http://www.nfl.com:80/news,Bolts expected to activate TE Henry on Monday,Los Angeles Chargers,0.8564734160900116
1426,2243.0,2019-01-07,http://web.archive.org/web/20190107060010/http://www.nfl.com:80/news,Prescott comes through in crunch time for Dallas,Dallas Cowboys,0.9917983739287592
1427,2244.0,2019-01-07,http://web.archive.org/web/20190107060010/http://www.nfl.com:80/news,Silver: Reich proves his worth in Colts' beatdown of Texans,Indianapolis Colts,0.998115289839916
1428,2248.0,2019-01-08,http://web.archive.org/web/20190108005408/http://www.espn.com/nfl/,Smith-Schuster to replace Brown in Pro Bowl,Cleveland Browns,0.7702277898788452
1429,2249.0,2019-01-08,http://web.archive.org/web/20190108005408/http://www.espn.com/nfl/,Parkey's FG miss for Bears changed to block,Chicago Bears,-0.7376060485839844
1430,2250.0,2019-01-08,http://web.archive.org/web/20190108005408/http://www.espn.com/nfl/,Ravens on booing Lamar: 'Plain disrespectful',Baltimore Ravens,-0.998880809856928
1431,2251.0,2019-01-08,http://web.archive.org/web/20190108025721/http://www.nfl.com/news,GIFs that help explain Wild Card Weekend: Horror euphoria in Chicago,Chicago Bears,-0.0012112920521758
1432,2255.0,2019-01-09,http://web.archive.org/web/20190109012747/http://www.espn.com/nfl/,Cardinals turn to Kingsbury as next head coach,Arizona Cardinals,0.7593470811843872
1433,2256.0,2019-01-09,http://web.archive.org/web/20190109012747/http://www.espn.com/nfl/,Sources: Broncos down to Fangio Munchak,Denver Broncos,-0.4726563990116119
1434,2257.0,2019-01-09,http://web.archive.org/web/20190109012747/http://www.espn.com/nfl/,Falcons welcome back Koetter to run offense,Atlanta Falcons,0.972175852395594
1435,2258.0,2019-01-09,http://web.archive.org/web/20190109012747/http://www.espn.com/nfl/,McDaniels: No more interviews staying with Pats,New England Patriots,-0.6046557724475861
1436,2259.0,2019-01-09,http://web.archive.org/web/20190109042422/http://www.nfl.com:80/news,Staying in South: Falcons hire Dirk Koetter as OC,Atlanta Falcons,0.0986852645874023
1437,2260.0,2019-01-09,http://web.archive.org/web/20190109042422/http://www.nfl.com:80/news,DDFP: Divisional Round preview; Who is to blame in Pittsburgh?,Pittsburgh Steelers,-0.5199207712430507
1438,2261.0,2019-01-10,http://web.archive.org/web/20190110025248/http://www.espn.com/nfl/,Payton woos Saints with Lombardi $200K cash,New Orleans Saints,0.8632070925086737
1439,2262.0,2019-01-10,http://web.archive.org/web/20190110025248/http://www.espn.com/nfl/,Sources: Browns to name Kitchens head coach,Cleveland Browns,0.7320809662342072
1440,2263.0,2019-01-10,http://web.archive.org/web/20190110025248/http://www.espn.com/nfl/,Sources: Broncos reach agreement with Fangio,Denver Broncos,0.815960094332695
1441,2264.0,2019-01-10,http://web.archive.org/web/20190110025248/http://www.espn.com/nfl/,Cardinals' Kingsbury: First priority is hiring staff,Arizona Cardinals,0.6689325496554375
1442,2265.0,2019-01-10,http://web.archive.org/web/20190110025248/http://www.espn.com/nfl/,Bowles to lead Bucs D despite late push by Bears,Tampa Bay Buccaneers,0.6054483652114868
1443,2266.0,2019-01-10,http://web.archive.org/web/20190110100424/http://www.nfl.com:80/news,Top O-lines of Wild Card Weekend: Colts are cruising,Indianapolis Colts,0.991627849987708
1444,2267.0,2019-01-11,http://web.archive.org/web/20190111030953/http://www.espn.com/nfl/,Sources: Bengals hope to hire Rams asst. Taylor,Cincinnati Bengals,0.6238615214824677
1445,2268.0,2019-01-11,http://web.archive.org/web/20190111030953/http://www.espn.com/nfl/,Sources: Fournette meets with Jags to clear air,Jacksonville Jaguars,0.2615419030189514
1446,2269.0,2019-01-11,http://web.archive.org/web/20190111030953/http://www.espn.com/nfl/,Darnold: Gase is right hire Jets fans will see,New York Jets,0.984542773105204
1447,2270.0,2019-01-11,http://web.archive.org/web/20190111083311/http://www.nfl.com/news,Eagles face huge decision; plus Frank Reich's rise and Matt LaFleur's challenge,Philadelphia Eagles,0.0138883590698242
1448,2271.0,2019-01-11,http://web.archive.org/web/20190111083311/http://www.nfl.com/news,Divisional Round game picks: Another one-and-done for the Rams?,Los Angeles Rams,-0.9957281282404438
1449,2272.0,2019-01-11,http://web.archive.org/web/20190111083311/http://www.nfl.com/news,Why Saints WR Michael Thomas is possessed with being best,New Orleans Saints,0.954986771917902
1450,2273.0,2019-01-12,http://web.archive.org/web/20190112004311/http://www.nfl.com:80/news,Patriots bring reliable line to counter Chargers' Bosa Ingram,New England Patriots,0.9125101640820504
1451,2274.0,2019-01-12,http://web.archive.org/web/20190112004311/http://www.nfl.com:80/news,Former Lions coach Rick Forzano 90 passes away,Detroit Lions,-0.7830198183655739
1452,2276.0,2019-01-12,http://web.archive.org/web/20190112041604/http://www.espn.com/nfl/,Brown to address Steelers drama 'at a later date',Cleveland Browns,-0.4843080269638449
1453,2277.0,2019-01-12,http://web.archive.org/web/20190112041604/http://www.espn.com/nfl/,Bears tap ex-Colts coach Pagano to take over D,Chicago Bears,0.1572188735008239
1454,2278.0,2019-01-12,http://web.archive.org/web/20190112041604/http://www.espn.com/nfl/,Source: Bucs hire former USC RB coach McNair,Tampa Bay Buccaneers,0.9125646688044072
1455,2279.0,2019-01-13,http://web.archive.org/web/20190113044814/http://www.espn.com/nfl/,Cards WR Fitzgerald still undecided on return,Arizona Cardinals,-0.4131849557161331
1456,2280.0,2019-01-13,http://web.archive.org/web/20190113044814/http://www.espn.com/nfl/,Dolphins hoping to hire Flores as next coach,Miami Dolphins,0.8918344788253307
1457,2281.0,2019-01-13,http://web.archive.org/web/20190113064740/http://www.nfl.com:80/news,Chiefs' defense dominates in first home playoff win in 25 years,Kansas City Chiefs,0.7603821009397507
1458,2284.0,2019-01-14,http://web.archive.org/web/20190114093815/http://www.nfl.com:80/news,Battista: Patriots don't care about naysayers just winning,New England Patriots,-0.2279151082038879
