,Unnamed: 0,archiveDate,Urls,headlines,team,total_score
5311,,2020-12-11,http://web.archive.org/web/20201211010419/https://www.espn.com/nfl/,Ravens' Bryant on COVID list says he's negative,Baltimore Ravens,-0.9982299642870203
5312,,2020-12-11,http://web.archive.org/web/20201211010419/https://www.espn.com/nfl/,Sherman: 'Miracle' needed for '21 return to 49ers,San Francisco 49ers,-0.05082324054092169
5313,,2020-12-11,http://web.archive.org/web/20201211010419/https://www.espn.com/nfl/,Niners' Williams: No grudges held toward WFT,San Francisco 49ers,0.7997566312551498
5314,,2020-12-11,http://web.archive.org/web/20201211010419/https://www.espn.com/nfl/,CB Griffin: Seahawks took Giants for granted,Seattle Seahawks,-0.9755113534629345
5315,,2020-12-11,http://web.archive.org/web/20201211010419/https://www.espn.com/nfl/,Rhule: McCaffrey not expected to play vs. Denver,Denver Broncos,-0.8252283483743668
5316,,2020-12-11,http://web.archive.org/web/20201211010419/https://www.espn.com/nfl/,Steelers' Williams on COVID list; LB woes persist,Pittsburgh Steelers,-0.9435436089988798
5317,,2020-12-11,http://web.archive.org/web/20201211010419/https://www.espn.com/nfl/,Bills sign GM Beane to multiyear extension,Buffalo Bills,0.9702639169991016
5318,,2020-12-12,http://web.archive.org/web/20201212024114/https://www.espn.com/nfl/,Seahawks' Adams: 'Have no hate' for Gase Jets,Seattle Seahawks,0.0
5319,,2020-12-12,http://web.archive.org/web/20201212030636/https://www.nfl.com/news/,Jamal Adams: I didn't feel Adam Gase 'handled certain situations well' during time with Jets,New York Jets,-0.9967238559038378
5320,,2020-12-12,http://web.archive.org/web/20201212030636/https://www.nfl.com/news/,Lions interview three internal candidates for general manager job,Detroit Lions,0.6169075295329094
5321,,2020-12-12,http://web.archive.org/web/20201212030636/https://www.nfl.com/news/,Giants QB Daniel Jones (hamstring) questionable but full participant in Friday practice,New York Giants,0.6850507780909538
5322,,2020-12-12,http://web.archive.org/web/20201212030636/https://www.nfl.com/news/,Three Panthers activated from reserve/COVID-19 list Friday,Carolina Panthers,0.7884205207228661
5324,,2020-12-13,http://web.archive.org/web/20201213055648/https://www.espn.com/nfl/,Source: Cowboys' Elliott to play with bruised calf,Dallas Cowboys,0.08030632138252258
5325,,2020-12-13,http://web.archive.org/web/20201213055648/https://www.espn.com/nfl/,Giants QB Jones to start vs. Cards source says,New York Giants,0.675570085644722
5326,,2020-12-13,http://web.archive.org/web/20201213055648/https://www.espn.com/nfl/,Dolphins' top RB Gaskin placed on COVID-19 list,Miami Dolphins,0.9194032996892929
5327,,2020-12-13,http://web.archive.org/web/20201213055648/https://www.espn.com/nfl/,Source: Panthers to fine players for virus issues,Carolina Panthers,-0.9073477610945702
5328,,2020-12-13,http://web.archive.org/web/20201213055648/https://www.espn.com/nfl/,Steelers not leaving for Buffalo until Sunday,Pittsburgh Steelers,-0.21769852936267853
5329,,2020-12-13,http://web.archive.org/web/20201213055648/https://www.espn.com/nfl/,Titans ownership stays solely in Adams family,Tennessee Titans,0.2108839973807335
5330,,2020-12-13,http://web.archive.org/web/20201213055648/https://www.espn.com/nfl/,McCarthy says better days ahead for Cowboys,Dallas Cowboys,0.9968690557871014
5331,,2020-12-14,http://web.archive.org/web/20201214023634/https://www.nfl.com/news/,Seahawks' Jamal Adams sets single-season record for most sacks by a DB in win over Jets,Seattle Seahawks,0.9469527676701546
5332,,2020-12-14,http://web.archive.org/web/20201214023634/https://www.nfl.com/news/,Green Bay Packers clinch NFC North title for second consecutive season,Green Bay Packers,0.9052759557962418
5333,,2020-12-14,http://web.archive.org/web/20201214023634/https://www.nfl.com/news/,Ron Rivera: Alex Smith strained calf in Washington's win over 49ers,Washington Football Team,-0.5200570076704025
5334,,2020-12-14,http://web.archive.org/web/20201214023634/https://www.nfl.com/news/,Giants coach Joe Judge: 'No regrets' playing hamstrung QB Daniel Jones,New York Giants,0.0068166255950927734
5336,,2020-12-14,http://web.archive.org/web/20201214031137/https://www.espn.com/nfl/,Hurts wins 1st QB start as Eagles stun Saints,Philadelphia Eagles,0.7270040363073349
5337,,2020-12-14,http://web.archive.org/web/20201214031137/https://www.espn.com/nfl/,Washington vaults into first place in NFC East,Washington Football Team,0.9864396173506975
5338,,2020-12-14,http://web.archive.org/web/20201214031137/https://www.espn.com/nfl/,Adams sets DB sacks mark as Seattle routs Jets,Seattle Seahawks,0.9324212707579136
5339,,2020-12-14,http://web.archive.org/web/20201214031137/https://www.espn.com/nfl/,Packers clinch NFC North: 'Definitely not done',Green Bay Packers,-0.24058985710144043
5340,,2020-12-14,http://web.archive.org/web/20201214031137/https://www.espn.com/nfl/,Lions' Stafford exits early has X-rays on hurt ribs,Detroit Lions,-0.19344520568847656
5341,,2020-12-14,http://web.archive.org/web/20201214031137/https://www.espn.com/nfl/,Vikes' hopes take hit as Bailey misses 4 kicks,Minnesota Vikings,-0.9963843236328103
5342,,2020-12-14,http://web.archive.org/web/20201214031137/https://www.espn.com/nfl/,Fins' loss ends Steelers' 2-year playoff drought,Miami Dolphins,-0.34945929050445557
5343,,2020-12-15,http://web.archive.org/web/20201215024706/https://www.espn.com/nfl/,Eagles to start Hurts again; torn ACL for McLeod,Philadelphia Eagles,-0.9918871134868823
5344,,2020-12-15,http://web.archive.org/web/20201215024706/https://www.espn.com/nfl/,49ers WR Samuel likely done for regular season,San Francisco 49ers,-0.8854148834943771
5345,,2020-12-15,http://web.archive.org/web/20201215024706/https://www.espn.com/nfl/,Darnold: Want to be 'Jet for life' but not my call,New York Jets,-0.517772763967514
5346,,2020-12-15,http://web.archive.org/web/20201215024706/https://www.espn.com/nfl/,Seeking to end skid Jags to start QB Minshew,Jacksonville Jaguars,-0.22143304347991943
5347,,2020-12-15,http://web.archive.org/web/20201215024706/https://www.espn.com/nfl/,Source: Texans S Reid (hand) out for season,Houston Texans,-0.9053681492805481
5348,,2020-12-15,http://web.archive.org/web/20201215024706/https://www.espn.com/nfl/,Colts' Reich: QB Rivers has 'multiple years' left,Indianapolis Colts,0.7892888486385345
5349,,2020-12-15,http://web.archive.org/web/20201215164827/https://www.nfl.com/news/,Harbaugh: Tucker only kicker I'd be confident in making game-winner in Cleveland,Cleveland Browns,0.8535110652446747
5350,,2020-12-15,http://web.archive.org/web/20201215164827/https://www.nfl.com/news/,Browns coach Kevin Stefanski not interested in 'moral victories' after loss to Ravens,Cleveland Browns,-0.9629992232657969
5351,,2020-12-15,http://web.archive.org/web/20201215164827/https://www.nfl.com/news/,What we learned from Ravens' thrilling Monday night win over Browns,Baltimore Ravens,0.8483128231018782
5352,,2020-12-15,http://web.archive.org/web/20201215164827/https://www.nfl.com/news/,Lamar Jackson (cramps) returns to lead Ravens to stunning comeback win vs. Browns,Baltimore Ravens,0.8425142988562584
5353,,2020-12-15,http://web.archive.org/web/20201215164827/https://www.nfl.com/news/,NFL Power Rankings Week 15: Packers jump to No. 2; Saints Steelers fall,Green Bay Packers,0.4573122560977936
5354,,2020-12-16,http://web.archive.org/web/20201216021028/http://www.espn.com/nfl/,Source: Bucs RB Jones getting pin put in finger,Tampa Bay Buccaneers,-0.8755929954349995
5355,,2020-12-16,http://web.archive.org/web/20201216021028/http://www.espn.com/nfl/,Source: Ravens QB McSorley likely sprained knee,Baltimore Ravens,-0.6038462519645691
5356,,2020-12-16,http://web.archive.org/web/20201216021028/http://www.espn.com/nfl/,Source: Eagles lose Driscoll as OL woes continue,Philadelphia Eagles,-0.9880337039940059
5358,,2020-12-17,http://web.archive.org/web/20201217074549/https://www.espn.com/nfl/,Texans attend Watson event in potential violation,Houston Texans,-0.9897858101176098
5359,,2020-12-17,http://web.archive.org/web/20201217074549/https://www.espn.com/nfl/,Former Ravens RB Lorenzo Taliaferro dies at 28,Baltimore Ravens,-0.027497828006744385
5360,,2020-12-17,http://web.archive.org/web/20201217074549/https://www.espn.com/nfl/,Lions center Ragnow fractured throat in game,Detroit Lions,-0.9743516147136688
5361,,2020-12-17,http://web.archive.org/web/20201217074549/https://www.espn.com/nfl/,Raiders rule out 4 defensive starters vs. Chargers,Las Vegas Raiders,-0.9550855755805969
5362,,2020-12-18,http://web.archive.org/web/20201218015409/https://www.espn.com/nfl/,Ravens CB called 'coward' says spit unintentional,Baltimore Ravens,-0.9980425378889777
5363,,2020-12-18,http://web.archive.org/web/20201218015409/https://www.espn.com/nfl/,Minshew: Ngakoue to be 'out for blood' vs. Jags,Jacksonville Jaguars,-0.10081921867094934
5364,,2020-12-18,http://web.archive.org/web/20201218015409/https://www.espn.com/nfl/,Washington loses key safety Everett (pec) to IR,Washington Football Team,-0.9853855632245541
5365,,2020-12-18,http://web.archive.org/web/20201218015409/https://www.espn.com/nfl/,Giants' Bradberry on COVID list out vs. Browns,New York Giants,0.3328510820865631
5366,,2020-12-18,http://web.archive.org/web/20201218015409/https://www.espn.com/nfl/,LB Correa leaves Jaguars for personal reasons,Jacksonville Jaguars,-0.8187870308756828
5368,,2020-12-18,http://web.archive.org/web/20201218101613/https://www.nfl.com/news/,What we learned from Chargers' win over Raiders on Thursday night,Los Angeles Chargers,0.8988151326775551
5369,,2020-12-18,http://web.archive.org/web/20201218101613/https://www.nfl.com/news/,Raiders fall short despite valiant effort from Marcus Mariota in place of injured Derek Carr,Las Vegas Raiders,-0.9732716237194836
5370,,2020-12-18,http://web.archive.org/web/20201218101613/https://www.nfl.com/news/,Ravens CB Marcus Peters denies spitting at Browns WR Jarvis Landry,Baltimore Ravens,-0.7162494510412216
5371,,2020-12-18,http://web.archive.org/web/20201218101613/https://www.nfl.com/news/,Thursday night inactives: Los Angeles Chargers at Las Vegas Raiders,Los Angeles Chargers,-0.6750498712062836
5373,,2020-12-19,http://web.archive.org/web/20201219050228/https://www.espn.com/nfl/,Brees set for Saints return but Thomas ruled out,New Orleans Saints,-0.4617137461900711
5374,,2020-12-19,http://web.archive.org/web/20201219050228/https://www.espn.com/nfl/,Haskins to start at QB after WFT rules out Smith,Washington Football Team,0.41344961524009705
5375,,2020-12-19,http://web.archive.org/web/20201219050228/https://www.espn.com/nfl/,One Ravens CB ruled out four listed questionable,Baltimore Ravens,-0.9212946915067732
5376,,2020-12-19,http://web.archive.org/web/20201219050228/https://www.espn.com/nfl/,Giants QB Jones uncertain to play vs. Browns,New York Giants,-0.7914198562502861
5377,,2020-12-19,http://web.archive.org/web/20201219050228/https://www.espn.com/nfl/,Lions list Stafford as questionable Ragnow as out,Detroit Lions,-0.9947751061990857
5378,,2020-12-19,http://web.archive.org/web/20201219050228/https://www.espn.com/nfl/,Tumor removed Colts' Sanchez to punt Sunday,Indianapolis Colts,-0.926103001460433
5379,,2020-12-19,http://web.archive.org/web/20201219205758/https://www.nfl.com/news/,Saturday doubleheader inactives: Buffalo Bills at Denver Broncos Carolina Panthers at Green Bay Packers,Buffalo Bills,-0.3992590606212616
5380,,2020-12-19,http://web.archive.org/web/20201219205758/https://www.nfl.com/news/,Giants QB Colt McCoy to start vs. Browns with Daniel Jones out,New York Giants,0.4222939610481262
5381,,2020-12-19,http://web.archive.org/web/20201219205758/https://www.nfl.com/news/,Bengals QB Ryan Finley to start vs. Steelers on Monday night,Cincinnati Bengals,0.3324633836746216
5383,,2020-12-20,http://web.archive.org/web/20201220025114/https://www.espn.com/nfl/,Saints' Thomas on IR expected back for playoffs,New Orleans Saints,0.0613783597946167
5384,,2020-12-20,http://web.archive.org/web/20201220025114/https://www.espn.com/nfl/,Ravens' Peters fined $12.5K over spitting incident,Baltimore Ravens,-0.9124765545129776
5385,,2020-12-20,http://web.archive.org/web/20201220025114/https://www.espn.com/nfl/,Steelers' Johnson hopes to cure a case of drops,Pittsburgh Steelers,-0.02078646421432495
5386,,2020-12-20,http://web.archive.org/web/20201220025114/https://www.espn.com/nfl/,Ravens activate Brown before game vs. Jaguars,Baltimore Ravens,0.7957806959748268
5387,,2020-12-20,http://web.archive.org/web/20201220025114/https://www.espn.com/nfl/,Patriots RB Harris out vs. Fins; Michel to get start,New England Patriots,-0.29002171754837036
5388,,2020-12-20,http://web.archive.org/web/20201220025114/https://www.espn.com/nfl/,Bengals to start Finley after QB Allen ruled out,Cincinnati Bengals,0.29034605622291565
5389,,2020-12-20,http://web.archive.org/web/20201220123752/https://www.nfl.com/news/,Injury roundup: Dolphins TE Mike Gesicki a game-time decision against Patriots,Miami Dolphins,-0.5079029574990273
5390,,2020-12-20,http://web.archive.org/web/20201220123752/https://www.nfl.com/news/,Packers QB Aaron Rodgers becomes first QB to throw 40 TDs in three separate seasons,Green Bay Packers,0.9299588240683079
5391,,2020-12-20,http://web.archive.org/web/20201220123752/https://www.nfl.com/news/,Buffalo Bills clinch AFC East title for first time since 1995 following dominant win over Broncos,Buffalo Bills,0.8561142832040787
5392,,2020-12-20,http://web.archive.org/web/20201220123752/https://www.nfl.com/news/,Saints WR Michael Thomas (ankle) placed on injured reserve,New Orleans Saints,-0.6490399986505508
5394,,2020-12-21,http://web.archive.org/web/20201221043938/https://www.espn.com/nfl/,Jets win first of season lose hold on top draft spot,New York Jets,-0.9846658734604716
5395,,2020-12-21,http://web.archive.org/web/20201221043938/https://www.espn.com/nfl/,Hurts continues to spark offense in Eagles' loss,Philadelphia Eagles,0.9085738509893417
5396,,2020-12-21,http://web.archive.org/web/20201221043938/https://www.espn.com/nfl/,Rookie Edwards-Helaire injured in Chiefs' victory,Kansas City Chiefs,-0.2602826803922653
5397,,2020-12-21,http://web.archive.org/web/20201221043938/https://www.espn.com/nfl/,Brees shaky in return as Saints fall to Chiefs,New Orleans Saints,-0.9952467135153711
5398,,2020-12-21,http://web.archive.org/web/20201221043938/https://www.espn.com/nfl/,AB caps 'long journey' with big TD in Bucs' rally,Tampa Bay Buccaneers,0.9692245559999719
5399,,2020-12-21,http://web.archive.org/web/20201221043938/https://www.espn.com/nfl/,Pats lose Gilmore playoff hopes in loss to Fins,New England Patriots,-0.990162376081571
5400,,2020-12-21,http://web.archive.org/web/20201221043938/https://www.espn.com/nfl/,Seahawks hold on to win clinch playoff berth,Seattle Seahawks,0.9770009638741612
5401,,2020-12-21,http://web.archive.org/web/20201221065815/https://www.nfl.com/news/,Eagles QB Jalen Hurts wows with 4 TDs in loss; Doug Pederson mum on starter,Philadelphia Eagles,-0.005092129111289978
5402,,2020-12-21,http://web.archive.org/web/20201221065815/https://www.nfl.com/news/,Chiefs RB Clyde Edwards-Helaire (leg/hip) to be further evaluated after exiting late vs. Saints,Kansas City Chiefs,-0.3730211406946182
5403,,2020-12-21,http://web.archive.org/web/20201221065815/https://www.nfl.com/news/,Sean McVay: Rams' loss to Jets 'embarrassing' 'humbling',Los Angeles Rams,-0.9984020300908014
5404,,2020-12-21,http://web.archive.org/web/20201221065815/https://www.nfl.com/news/,Saints DE Cam Jordan ejected after throwing punch in loss to Chiefs,New Orleans Saints,-0.91644925205037
5406,,2020-12-22,http://web.archive.org/web/20201222002533/https://www.espn.com/nfl/,Chiefs Pack Ravens Hawks lead in Pro Bowlers,Kansas City Chiefs,0.45742088556289673
5407,,2020-12-22,http://web.archive.org/web/20201222002533/https://www.espn.com/nfl/,Steelers downgrade RB Conner to out for MNF,Pittsburgh Steelers,-0.9760957695543766
5408,,2020-12-22,http://web.archive.org/web/20201222002533/https://www.espn.com/nfl/,Eagles to roll again with Hurts as QB vs. Dallas,Philadelphia Eagles,0.9863677825778723
5409,,2020-12-22,http://web.archive.org/web/20201222002533/https://www.espn.com/nfl/,Lions fire ST coach one day after failed fake punt,Detroit Lions,-0.9943289700895548
5410,,2020-12-22,http://web.archive.org/web/20201222002533/https://www.espn.com/nfl/,Jags' Marrone trying to win not secure top pick,Jacksonville Jaguars,-0.9252257868647575
5411,,2020-12-22,http://web.archive.org/web/20201222002533/https://www.espn.com/nfl/,Jets elated about 1st win; 'means the world to us',New York Jets,0.996625871717697
5412,,2020-12-22,http://web.archive.org/web/20201222152137/https://www.nfl.com/news/,Frank Reich 'glad' Colts are in 'shocking' playoff race,Indianapolis Colts,0.9899806128814816
5413,,2020-12-22,http://web.archive.org/web/20201222152137/https://www.nfl.com/news/,Carolina Panthers-Washington Football Team Week 16 matchup moved to late window,Carolina Panthers,0.3624168932437897
5414,,2020-12-22,http://web.archive.org/web/20201222152137/https://www.nfl.com/news/,'Two weeks out' from playoffs skidding Steelers not getting job done,Pittsburgh Steelers,-0.99659395578783
5415,,2020-12-22,http://web.archive.org/web/20201222152137/https://www.nfl.com/news/,What we learned from Bengals' win over Steelers on Monday night,Cincinnati Bengals,0.9025556044653058
5416,,2020-12-22,http://web.archive.org/web/20201222152137/https://www.nfl.com/news/,Rams RB Cam Akers (ankle) to miss Week 16 vs. Seahawks,Los Angeles Rams,-0.8167354092001915
5417,,2020-12-22,http://web.archive.org/web/20201222152137/https://www.nfl.com/news/,NFL Power Rankings Week 16: Bills rise to No. 2; Steelers in free fall,Buffalo Bills,0.32603907585144043
5418,,2020-12-23,http://web.archive.org/web/20201223185142/https://www.espn.com/nfl/,Jets DT Williams' big season ends with injury,New York Jets,-0.7865547239780426
5419,,2020-12-23,http://web.archive.org/web/20201223185142/https://www.espn.com/nfl/,Pats' Fisch replaces Sumlin as Arizona's coach,New England Patriots,0.5755630731582642
5420,,2020-12-23,http://web.archive.org/web/20201223185142/https://www.espn.com/nfl/,Several Lions coaches out for contact tracing,Detroit Lions,0.02695782482624054
5421,,2020-12-23,http://web.archive.org/web/20201223185142/https://www.espn.com/nfl/,Source: Seattle's Gordon has setback in recovery,Seattle Seahawks,-0.993745157495141
5422,,2020-12-23,http://web.archive.org/web/20201223185142/https://www.espn.com/nfl/,Sources: Desperate for QBs 49ers adding Rosen,San Francisco 49ers,0.3967498540878296
5423,,2020-12-23,http://web.archive.org/web/20201223234017/https://www.nfl.com/news/,Derek Carr (groin) improves to full participant in Raiders' Wednesday practice,Las Vegas Raiders,0.9561859834939241
5424,,2020-12-23,http://web.archive.org/web/20201223234017/https://www.nfl.com/news/,Jim Irsay: Colts are 'most complete team in the league',Indianapolis Colts,0.9879608753835782
5425,,2020-12-23,http://web.archive.org/web/20201223234017/https://www.nfl.com/news/,What to watch for in Minnesota Vikings-New Orleans Saints on Christmas Day,Minnesota Vikings,0.15846459567546844
5426,,2020-12-23,http://web.archive.org/web/20201223234017/https://www.nfl.com/news/,Former Bengals coach Marvin Lewis expected to interview for Texans HC job,Cincinnati Bengals,0.35498538613319397
5428,,2020-12-24,http://web.archive.org/web/20201224204332/https://www.espn.com/nfl/,Snyder: WFT minority owner trying to extort me,Washington Football Team,-0.9939660598756745
5429,,2020-12-25,http://web.archive.org/web/20201225015654/https://www.espn.com/nfl/,Lions' Bevell won't coach Sat. vs. Buccaneers,Detroit Lions,-0.6456544697284698
5430,,2020-12-26,http://web.archive.org/web/20201226091446/https://www.espn.com/nfl/,Saints' Kamara ties NFL record with 6 rush TDs,New Orleans Saints,0.9723709500394762
5431,,2020-12-26,http://web.archive.org/web/20201226091446/https://www.espn.com/nfl/,Source: Saints lose LB Alexander to torn Achilles,New Orleans Saints,-0.9883024604059756
5432,,2020-12-26,http://web.archive.org/web/20201226091446/https://www.espn.com/nfl/,Zimmer on Vikes' D: 'Worst one I've ever had',Minnesota Vikings,-0.9983275813865475
5433,,2020-12-26,http://web.archive.org/web/20201226091446/https://www.espn.com/nfl/,Source: Ryan Giants agree to 3-year $30M deal,New York Giants,0.727561429142952
5434,,2020-12-26,http://web.archive.org/web/20201226091446/https://www.espn.com/nfl/,WFT QB Smith (calf) practices still questionable,Washington Football Team,-0.7466854974627495
5435,,2020-12-26,http://web.archive.org/web/20201226091446/https://www.espn.com/nfl/,Falcons WR Jones C Mack ruled out vs. Chiefs,Atlanta Falcons,-0.8886922523379326
5436,,2020-12-26,http://web.archive.org/web/20201226203933/https://www.nfl.com/news/,Browns' flight to New Jersey delayed following positive COVID-19 test,Cleveland Browns,0.9969696259358898
5437,,2020-12-26,http://web.archive.org/web/20201226203933/https://www.nfl.com/news/,Tom Brady sets Buccaneers franchise record with 34th TD pass of 2020 season,Tampa Bay Buccaneers,0.8518749214708805
5438,,2020-12-26,http://web.archive.org/web/20201226203933/https://www.nfl.com/news/,Lions QB Matthew Stafford (ankle) ruled out vs. Bucs,Detroit Lions,-0.9351566582918167
5439,,2020-12-26,http://web.archive.org/web/20201226203933/https://www.nfl.com/news/,Jaguars QB Mike Glennon back in starting lineup for game vs. Bears,Jacksonville Jaguars,0.12974417209625244
5441,,2020-12-27,http://web.archive.org/web/20201227234303/https://www.espn.com/nfl/,Chiefs clinch No. 1 seed as Kelce sets records,Kansas City Chiefs,0.9275065250694752
5442,,2020-12-27,http://web.archive.org/web/20201227234303/https://www.espn.com/nfl/,Jags dream of Lawrence after clinching No. 1 pick,Jacksonville Jaguars,0.9066641256213188
5443,,2020-12-27,http://web.archive.org/web/20201227234303/https://www.espn.com/nfl/,Watt rants on Texans' effort: If you don't care go,Houston Texans,-0.9918471082346514
5444,,2020-12-27,http://web.archive.org/web/20201227234303/https://www.espn.com/nfl/,Mayfield says he 'failed' Browns in loss to Jets,Cleveland Browns,-0.9980451711453497
5445,,2020-12-27,http://web.archive.org/web/20201227234303/https://www.espn.com/nfl/,Bolts' Herbert sets rookie record for TD passes,Los Angeles Chargers,0.9592852292116731
5446,,2020-12-27,http://web.archive.org/web/20201227234303/https://www.espn.com/nfl/,Big Ben drives rally as Steelers clinch AFC North,Pittsburgh Steelers,0.94394700974226
5448,,2020-12-28,http://web.archive.org/web/20201228021142/https://www.nfl.com/news/,Rams QB Jared Goff suffers broken thumb in loss to Seahawks,Los Angeles Rams,-0.868863114155829
5449,,2020-12-28,http://web.archive.org/web/20201228021142/https://www.nfl.com/news/,Seahawks defeat Rams clinch first NFC West crown since 2016,Seattle Seahawks,0.75105881690979
5450,,2020-12-28,http://web.archive.org/web/20201228021142/https://www.nfl.com/news/,Washington benches QB Dwayne Haskins after multi-turnover day in loss to Panthers,Washington Football Team,-0.9845988680608571
5451,,2020-12-28,http://web.archive.org/web/20201228021142/https://www.nfl.com/news/,Chargers QB Justin Herbert sets new single-season rookie record for TD passes,Los Angeles Chargers,0.9617086360231042
5453,,2020-12-29,http://web.archive.org/web/20201229001509/https://www.nfl.com/news/,Monday night inactives: Buffalo Bills at New England Patriots,Buffalo Bills,-0.6159219108521938
5454,,2020-12-29,http://web.archive.org/web/20201229001509/https://www.nfl.com/news/,Titans place kicker Stephen Gostkowski on reserve/COVID-19 list,Tennessee Titans,-0.7934511452913284
5455,,2020-12-29,http://web.archive.org/web/20201229001509/https://www.nfl.com/news/,John Brown (ankle) off injured reserve moved to reserve/COVID-19 list,Cleveland Browns,-0.42910243570804596
5456,,2020-12-29,http://web.archive.org/web/20201229001509/https://www.nfl.com/news/,Kingsbury: Cardinals 'hopeful' Kyler Murray (leg) can play in Week 17,Arizona Cardinals,0.7684521935880184
5457,,2020-12-29,http://web.archive.org/web/20201229001509/https://www.nfl.com/news/,Kevin Stefanski: Browns' close contacts could return Thursday if they test negative,Cleveland Browns,-0.8359271101653576
5459,,2020-12-29,http://web.archive.org/web/20201229014959/https://www.espn.com/nfl/,Rams' Goff undergoes thumb surgery out Sunday,Los Angeles Rams,-0.5417296811938286
5460,,2020-12-29,http://web.archive.org/web/20201229014959/https://www.espn.com/nfl/,Seahawks cutting out 'Snacks' waive Harrison,Seattle Seahawks,-0.8095168620347977
5461,,2020-12-29,http://web.archive.org/web/20201229014959/https://www.espn.com/nfl/,Jets' Gore out for Week 17 with future uncertain,New York Jets,-0.9857511287555099
5462,,2020-12-29,http://web.archive.org/web/20201229014959/https://www.espn.com/nfl/,Lions QB Stafford (ankle) uncertain for finale,Detroit Lions,-0.5927551798522472
5463,,2020-12-29,http://web.archive.org/web/20201229014959/https://www.espn.com/nfl/,Reid to rest some Chiefs starters vs. Chargers,Kansas City Chiefs,0.15673556923866272
5464,,2020-12-30,http://web.archive.org/web/20201230010349/https://www.espn.com/nfl/,Big Ben to sit Rudolph to start against Browns,Cleveland Browns,-0.5303748100996017
5465,,2020-12-30,http://web.archive.org/web/20201230010349/https://www.espn.com/nfl/,Kupp status iffy as Rams place WR on COVID list,Los Angeles Rams,-0.7121201360132545
5466,,2020-12-30,http://web.archive.org/web/20201230010349/https://www.espn.com/nfl/,Washington LB Davis says he'll retire after 2020,Washington Football Team,0.152442067861557
5467,,2020-12-30,http://web.archive.org/web/20201230010349/https://www.espn.com/nfl/,Browns place TE Bryant S Sendejo on COVID list,Cleveland Browns,0.4131193459033966
