,Unnamed: 0,archiveDate,Urls,headlines,team,total_score
2614,3740.0,2019-12-18,http://web.archive.org/web/20191218093906/http://www.nfl.com/news,Power Rankings: Saints go marching UP; Niners dip following stunning loss,New Orleans Saints,0.8075310261920094
2615,3742.0,2019-12-19,http://web.archive.org/web/20191219033313/http://www.espn.com/nfl/,Browns' Beckham: 'I'm not going anywhere',Cleveland Browns,0.4770556390285492
2616,3743.0,2019-12-20,http://web.archive.org/web/20191220044236/http://www.espn.com/nfl/,Jets' Bell expects Steelers fans' boos at home,New York Jets,-0.9757220735773444
2617,3744.0,2019-12-20,http://web.archive.org/web/20191220044236/http://www.espn.com/nfl/,Thomas gifts Saints teammates Air Jordan 11s,New Orleans Saints,0.8842989061959088
2618,3745.0,2019-12-20,http://web.archive.org/web/20191220044236/http://www.espn.com/nfl/,It's about time: Jags fix clocks post-Coughlin,Jacksonville Jaguars,0.9257324934005736
2619,3747.0,2019-12-20,http://web.archive.org/web/20191220044236/http://www.espn.com/nfl/,Bucs rule out Pro Bowl WR Godwin vs. Texans,Tampa Bay Buccaneers,-0.86580491065979
2620,3748.0,2019-12-20,http://web.archive.org/web/20191220115734/https://www.nfl.com/news,How to improve Steelers' run game; Pack's use of Jimmy Graham,Pittsburgh Steelers,0.7486238526180387
2621,3749.0,2019-12-20,http://web.archive.org/web/20191220115734/https://www.nfl.com/news,Week 16 picks: Can Buffalo topple New England? Will Dallas clinch the East?,Buffalo Bills,0.3891277909278869
2622,3750.0,2019-12-21,http://web.archive.org/web/20191221004126/https://www.nfl.com/news,Three dark-horse contenders to make deep playoff run; Plus Texans' terrors,Houston Texans,0.0814232360571622
2623,3751.0,2019-12-21,http://web.archive.org/web/20191221004126/https://www.nfl.com/news,Week 16 bold predictions: Le'Veon Bell gets REVENGE! Titans upset Saints,Tennessee Titans,0.8902430599555373
2624,3752.0,2019-12-21,http://web.archive.org/web/20191221004126/https://www.nfl.com/news,DB Kelly arrested for threats; released by Steelers,Pittsburgh Steelers,-0.9519147342070936
2625,3753.0,2019-12-21,http://web.archive.org/web/20191221004126/https://www.nfl.com/news,How the Packers plan to stop Kirk Cousins; plus Deebo Samuel's rise and more,Green Bay Packers,0.5775983221828938
2626,3755.0,2019-12-21,http://web.archive.org/web/20191221010504/https://www.espn.com/nfl/,Dak not on injury report to start vs. Eagles,Philadelphia Eagles,0.8321440890431404
2627,3756.0,2019-12-21,http://web.archive.org/web/20191221010504/https://www.espn.com/nfl/,Seahawks DT Woods suspended four games,Seattle Seahawks,-0.9331464655697346
2628,3757.0,2019-12-21,http://web.archive.org/web/20191221010504/https://www.espn.com/nfl/,Ward wants Gatorade shower if Jets top Steelers,New York Jets,0.8466950729489326
2629,3758.0,2019-12-21,http://web.archive.org/web/20191221010504/https://www.espn.com/nfl/,Steelers waive S Kelly after arrest outside bar,Pittsburgh Steelers,-0.7323060631752014
2630,3759.0,2019-12-21,http://web.archive.org/web/20191221010504/https://www.espn.com/nfl/,Jones back to start for Giants over Manning,New York Giants,0.6649475246667862
2631,3760.0,2019-12-21,http://web.archive.org/web/20191221010504/https://www.espn.com/nfl/,Getting Bred: Thomas gifts Saints Air Jordan 11s,New Orleans Saints,0.9048359580338
2632,3761.0,2019-12-22,http://web.archive.org/web/20191222021025/https://www.espn.com/nfl/,Brady leads comeback as Pats clinch AFC East,New England Patriots,0.916468633338809
2633,3762.0,2019-12-22,http://web.archive.org/web/20191222021025/https://www.espn.com/nfl/,Texans wrap up AFC South title eye No. 3 seed,Houston Texans,0.7980202436447144
2634,3763.0,2019-12-22,http://web.archive.org/web/20191222021025/https://www.espn.com/nfl/,Brother of 49ers' Beathard fatally stabbed in fight,San Francisco 49ers,-0.6462055370211601
2635,3764.0,2019-12-22,http://web.archive.org/web/20191222021025/https://www.espn.com/nfl/,Vikings' Cook out vs. Pack; backup Mattison iffy,Minnesota Vikings,-0.8813544511795044
2636,3765.0,2019-12-22,http://web.archive.org/web/20191222021025/https://www.espn.com/nfl/,Seahawks rule out OT Brown as injuries mount,Seattle Seahawks,-0.9255329743027688
2637,3766.0,2019-12-22,http://web.archive.org/web/20191222021025/https://www.espn.com/nfl/,Lions activate RB Johnson from injured reserve,Detroit Lions,0.8249707743525505
2638,3767.0,2019-12-22,http://web.archive.org/web/20191222025652/https://www.nfl.com/news,Brother of 49ers' C.J. Beathard killed in stabbing,San Francisco 49ers,-0.3402927815914154
2639,3768.0,2019-12-22,http://web.archive.org/web/20191222025652/https://www.nfl.com/news,Bucs slated to bring back Jameis Winston for 2020,Tampa Bay Buccaneers,0.5503694415092468
2640,3772.0,2019-12-23,http://web.archive.org/web/20191223024658/https://www.espn.com/nfl/,Saints' Thomas breaks Harrison's catches record,New Orleans Saints,0.9328806912526488
2641,3773.0,2019-12-23,http://web.archive.org/web/20191223024658/https://www.espn.com/nfl/,Jackson mark leads Ravens to No. 1; Ingram hurt,Baltimore Ravens,0.8933701291680336
2642,3774.0,2019-12-23,http://web.archive.org/web/20191223024658/https://www.espn.com/nfl/,Steelers banged up as playoff hopes take hit,Pittsburgh Steelers,-0.9647944640601054
2643,3775.0,2019-12-23,http://web.archive.org/web/20191223024658/https://www.espn.com/nfl/,Ex-Steeler Ward gets Gatorade bath after Jets win,Pittsburgh Steelers,0.6473293006420135
2644,3776.0,2019-12-23,http://web.archive.org/web/20191223024658/https://www.espn.com/nfl/,Losing pays off for Bengals who clinch No. 1 pick,Cincinnati Bengals,0.7345908582210541
2645,3777.0,2019-12-23,http://web.archive.org/web/20191223140752/https://www.nfl.com/news,Colts not expecting Luck back; could look for QB?,Indianapolis Colts,-0.2029629349708557
2646,3778.0,2019-12-23,http://web.archive.org/web/20191223140752/https://www.nfl.com/news,Jags' changes could be limited to Coughlin firing,Jacksonville Jaguars,-0.5091761350631714
2647,3779.0,2019-12-23,http://web.archive.org/web/20191223140752/https://www.nfl.com/news,Rams coach McVay vows to be better in wake of loss,Los Angeles Rams,-0.8351402813568711
2648,3780.0,2019-12-23,http://web.archive.org/web/20191223140752/https://www.nfl.com/news,Patriots' offense finds identity in division-clinching win over Bills,New England Patriots,0.9832797460258008
2649,3783.0,2019-12-24,http://web.archive.org/web/20191224033740/https://www.espn.com/nfl/,Source: Seattle inks Turbin; Lynch has physical,Seattle Seahawks,0.2317840158939361
2650,3784.0,2019-12-24,http://web.archive.org/web/20191224033740/https://www.espn.com/nfl/,Sources: McCarthy interviewed with Panthers,Carolina Panthers,0.3539968430995941
2651,3785.0,2019-12-24,http://web.archive.org/web/20191224033740/https://www.espn.com/nfl/,Cowboys LB Vander Esch (neck) out for season,Dallas Cowboys,-0.9779318030923604
2652,3786.0,2019-12-24,http://web.archive.org/web/20191224033740/https://www.espn.com/nfl/,Ravens to sit Lamar other starters vs. Steelers,Baltimore Ravens,-0.4657253623008728
2653,3787.0,2019-12-24,http://web.archive.org/web/20191224033740/https://www.espn.com/nfl/,Sources: Eagles' Ertz has fractured rib; Ajayi cut,Philadelphia Eagles,-0.6243492662906647
2654,3788.0,2019-12-24,http://web.archive.org/web/20191224033740/https://www.espn.com/nfl/,Gruden: Raiders won't rush back Jacobs others,Las Vegas Raiders,-0.2627443373203277
2655,3789.0,2019-12-24,http://web.archive.org/web/20191224033740/https://www.espn.com/nfl/,Fangio hopeful Lock is Broncos' franchise QB,Denver Broncos,0.9820973384194076
2656,3790.0,2019-12-24,http://web.archive.org/web/20191224145219/https://www.nfl.com/news,Trotter: Packers silence Vikings to win NFC North,Green Bay Packers,0.7177599966526031
2657,3791.0,2019-12-24,http://web.archive.org/web/20191224145219/https://www.nfl.com/news,Updated 2020 NFL Draft order: Cowboys in top 15 after crushing loss,Dallas Cowboys,-0.8400683146901429
2658,3792.0,2019-12-25,http://web.archive.org/web/20191225032926/http://www.nfl.com/news,Power Rankings: Seahawks drop after disastrous day; Eagles soaring into playoffs?,Seattle Seahawks,-0.9392570953350514
2659,3793.0,2019-12-25,http://web.archive.org/web/20191225032926/http://www.nfl.com/news,Clark: No one's going to 'sleep' on Pack anymore,Green Bay Packers,-0.0746541023254394
2660,3795.0,2019-12-25,http://web.archive.org/web/20191225035928/https://www.espn.com/nfl/,Seahawks RB Lynch: Being back 'a great feeling',Seattle Seahawks,0.9972339429659768
2661,3796.0,2019-12-25,http://web.archive.org/web/20191225035928/https://www.espn.com/nfl/,Texans' Watt (muscle tear) returning to practice,Houston Texans,0.630999282002449
2662,3797.0,2019-12-25,http://web.archive.org/web/20191225035928/https://www.espn.com/nfl/,Lamar gifts Rolex watches to Ravens' O-line,Baltimore Ravens,0.8213543342426419
2663,3798.0,2019-12-25,http://web.archive.org/web/20191225035928/https://www.espn.com/nfl/,Beast Mode is back: RB Lynch joins Seahawks,Seattle Seahawks,0.9894876866601408
2664,3799.0,2019-12-25,http://web.archive.org/web/20191225035928/https://www.espn.com/nfl/,Rams rule CB Ramsey (knee) out for finale,Los Angeles Rams,-0.8877347148954868
2665,3800.0,2019-12-25,http://web.archive.org/web/20191225035928/https://www.espn.com/nfl/,Packers run over Vikings to clinch NFC North,Green Bay Packers,0.892242081463337
2666,3801.0,2019-12-25,http://web.archive.org/web/20191225035928/https://www.espn.com/nfl/,Steelers place QB Rudolph (shoulder) on IR,Pittsburgh Steelers,-0.913355827331543
2667,3802.0,2019-12-26,http://web.archive.org/web/20191226003051/http://www.nfl.com:80/news,MJD is ALL In on Seahawks Beast Mode reunion; plus updated rankings,Seattle Seahawks,0.8797307247295976
2668,3805.0,2019-12-26,http://web.archive.org/web/20191226034701/https://www.espn.com/nfl,Saints to play starters with shot at No. 1 or 2 seed,New Orleans Saints,0.8880385123193264
2669,3806.0,2019-12-26,http://web.archive.org/web/20191226034701/https://www.espn.com/nfl,Chiefs put RB Ware on IR activate DT Williams,Kansas City Chiefs,0.1458097100257873
2670,3810.0,2019-12-27,http://web.archive.org/web/20191227013140/http://www.nfl.com/news,Washington QB Eason plans to enter 2020 draft,Washington Football Team,0.294372946023941
2671,3811.0,2019-12-27,http://web.archive.org/web/20191227013140/http://www.nfl.com/news,Week 17 game picks: Will 49ers clinch No. 1 seed against Seahawks?,San Francisco 49ers,0.5547751784324646
2672,3813.0,2019-12-27,http://web.archive.org/web/20191227044016/https://www.espn.com/nfl,Giants' Golden earns $1M bonus after stat change,New York Giants,0.9834350671735592
2673,3814.0,2019-12-27,http://web.archive.org/web/20191227044016/https://www.espn.com/nfl,Rams DC Phillips not listening to reports of ouster,Los Angeles Rams,-0.9650918387342244
2674,3815.0,2019-12-27,http://web.archive.org/web/20191227044016/https://www.espn.com/nfl,Washington QB Eason leaving to enter NFL draft,Washington Football Team,-0.3960128724575043
2675,3816.0,2019-12-28,http://web.archive.org/web/20191228000509/http://www.nfl.com/news,Week 17 storylines: How will Seahawks fare vs. vaunted 49ers D?,Seattle Seahawks,0.0839671343564987
2676,3817.0,2019-12-28,http://web.archive.org/web/20191228000509/http://www.nfl.com/news,Week 17 bold predictions: Raiders earn playoff berth records fall,Las Vegas Raiders,0.3727951645851135
2677,3820.0,2019-12-28,http://web.archive.org/web/20191228062402/https://www.espn.com/nfl/,Saints work out AB want clarity on eligibility,New Orleans Saints,-0.0574999451637268
2678,3821.0,2019-12-28,http://web.archive.org/web/20191228062402/https://www.espn.com/nfl/,Raiders' Jacobs (shoulder) doubtful for final week,Las Vegas Raiders,-0.9196038879454136
2679,3822.0,2019-12-28,http://web.archive.org/web/20191228062402/https://www.espn.com/nfl/,No Conner for Steelers in must-win Ravens game,Pittsburgh Steelers,-0.8904419019818306
2680,3823.0,2019-12-28,http://web.archive.org/web/20191228062402/https://www.espn.com/nfl/,49ers' DL depth hit again as Taylor tears ACL,San Francisco 49ers,-0.8602562537416816
2681,3824.0,2019-12-28,http://web.archive.org/web/20191228062402/https://www.espn.com/nfl/,Bell wants in as Jets rebuild: 'I'm here for it',New York Jets,0.8832897692918777
2682,3825.0,2019-12-29,http://web.archive.org/web/20191229024433/http://www.nfl.com/news,Cowboys' offensive issues a simple fix; Improving 49ers' defense,Dallas Cowboys,0.8974642679095268
2683,3828.0,2019-12-29,http://web.archive.org/web/20191229070329/https://www.espn.com/nfl/,Source: Allen done running Redskins' football ops,Washington Football Team,0.3387838006019592
2684,3829.0,2019-12-29,http://web.archive.org/web/20191229070329/https://www.espn.com/nfl/,Lions WR Jones says 6-month-old son died Friday,Detroit Lions,-0.9802106963470578
2685,3830.0,2019-12-29,http://web.archive.org/web/20191229070329/https://www.espn.com/nfl/,Source: Ravens Peters reach $42M extension,Baltimore Ravens,0.8611990809440613
2686,3831.0,2019-12-29,http://web.archive.org/web/20191229070329/https://www.espn.com/nfl/,Source: Texans ink Mercilus to 4-year $54M deal,Houston Texans,0.8879933208227158
2687,3832.0,2019-12-29,http://web.archive.org/web/20191229070329/https://www.espn.com/nfl/,Sources: Rivera is primary candidate for Redskins,Washington Football Team,0.4569616615772247
2688,3833.0,2019-12-29,http://web.archive.org/web/20191229070329/https://www.espn.com/nfl/,Sources: Jaguars planning to dismiss Marrone,Jacksonville Jaguars,-0.8838958144187927
2689,3834.0,2019-12-30,http://web.archive.org/web/20191230015235/http://www.espn.com/nfl/,Banged-up Eagles keep rolling to clinch NFC East,Philadelphia Eagles,0.9510450828820468
2690,3835.0,2019-12-30,http://web.archive.org/web/20191230085728/http://www.nfl.com/news,Browns back to the drawing board after firing Freddie Kitchens,Cleveland Browns,-0.8548218756914139
2691,3837.0,2019-12-31,http://web.archive.org/web/20191231005148/https://www.espn.com/nfl,Cowboys yet to announce decision on Garrett,Dallas Cowboys,-0.3863455355167389
2692,3838.0,2020-01-01,http://web.archive.org/web/20200101004402/http://www.nfl.com/news,Power Rankings: Patriots sputter into playoffs; Miami ends season on high note,New England Patriots,0.1980697214603424
2693,3839.0,2020-01-01,http://web.archive.org/web/20200101051850/https://www.espn.com/nfl/,General manager Dorsey Browns opt to part ways,Cleveland Browns,-0.938427910208702
2694,3840.0,2020-01-01,http://web.archive.org/web/20200101051850/https://www.espn.com/nfl/,Giants' Gettleman: I'm not doing good enough,New York Giants,-0.995508753694594
3842,,2020-01-01,http://web.archive.org/web/20200101051850/https://www.espn.com/nfl/,Rams GM: No regrets on huge Goff Gurley deals,Los Angeles Rams,0.9899158731568605
3843,,2020-01-01,http://web.archive.org/web/20200101051850/https://www.espn.com/nfl/,Antonio Brown: Saints workout a publicity stunt,Cleveland Browns,-0.9869360215961933
3844,,2020-01-01,http://web.archive.org/web/20200101051850/https://www.espn.com/nfl/,Jets GM vows to improve communication to team,New York Jets,-0.18802377581596375
3846,,2020-01-03,http://web.archive.org/web/20200103032925/https://www.nfl.com/news,Bengals Lions staffs to coach 2020 Senior Bowl,Cincinnati Bengals,0.5921669155359268
3847,,2020-01-03,http://web.archive.org/web/20200103043115/https://www.espn.com/nfl/,Coming off loss Patriots offer betting value,New England Patriots,-0.8459756523370743
3848,,2020-01-04,http://web.archive.org/web/20200104033415/https://www.nfl.com/news,In Spags they trust: How Chiefs' D transformed from embarrassing to imposing,Kansas City Chiefs,0.949383158236742
3849,,2020-01-05,http://web.archive.org/web/20200105033740/https://www.nfl.com/news,NFL Research: Numbers behind Texans' comeback,Houston Texans,0.7934478594688699
3851,,2020-01-05,http://web.archive.org/web/20200105151600/https://www.espn.com/nfl/,Brady after Pats' loss: Retirement 'pretty unlikely',New England Patriots,-0.9455932416021824
3852,,2020-01-05,http://web.archive.org/web/20200105151600/https://www.espn.com/nfl/,Henry rolls up 182 yards rushing to carry Titans,Tennessee Titans,0.9515937166288495
3853,,2020-01-05,http://web.archive.org/web/20200105151600/https://www.espn.com/nfl/,Bills' Allen takes loss hard: 'I've got to be better',Buffalo Bills,-0.987682158825919
3854,,2020-01-05,http://web.archive.org/web/20200105151600/https://www.espn.com/nfl/,Sources: NFL to discipline Pats for video violation,New England Patriots,-0.9586556134745479
3855,,2020-01-05,http://web.archive.org/web/20200105151600/https://www.espn.com/nfl/,Sources: Cowboys meeting with McCarthy Lewis,Dallas Cowboys,0.36569033563137054
3856,,2020-01-05,http://web.archive.org/web/20200105151600/https://www.espn.com/nfl/,Source: Eagles' Ertz expected to face Seahawks,Philadelphia Eagles,0.7804539427161217
3857,,2020-01-06,http://web.archive.org/web/20200106034428/http://www.espn.com/nfl/,Eagles: Hit on Wentz dirty; Clowney denies intent,Philadelphia Eagles,-0.9957860081340186
3858,,2020-01-06,http://web.archive.org/web/20200106034428/http://www.espn.com/nfl/,Bears guard Long 31 'stepping away' from NFL,Chicago Bears,-0.8017709627747536
3859,,2020-01-06,http://web.archive.org/web/20200106034428/http://www.espn.com/nfl/,Officials: No interference on Vikings' winning TD,Minnesota Vikings,0.9444686742499471
3860,,2020-01-06,http://web.archive.org/web/20200106034428/http://www.espn.com/nfl/,Garrett's tenure as Cowboys coach officially over,Dallas Cowboys,-0.7934271842241287
3861,,2020-01-06,http://web.archive.org/web/20200106034428/http://www.espn.com/nfl/,Belichick: Not time to talk Brady's future with Pats,New England Patriots,-0.6827463880181313
3862,,2020-01-06,http://web.archive.org/web/20200106044020/https://www.nfl.com/news,D.K. Metcalf rewards Seahawks' trust in win over Eagles,Seattle Seahawks,0.9798275269567966
3863,,2020-01-06,http://web.archive.org/web/20200106044020/https://www.nfl.com/news,Chadiha: Cousins the best QB to lead underdog Vikings,Minnesota Vikings,0.9174193404614925
3864,,2020-01-06,http://web.archive.org/web/20200106044020/https://www.nfl.com/news,Will Jerry Jones have to change to land coach who can fix Cowboys?,Dallas Cowboys,-0.5468305051326752
3865,,2020-01-06,http://web.archive.org/web/20200106044020/https://www.nfl.com/news,'I knew I wasn't going down': Watson breaks down epic play vs. Bills,Buffalo Bills,0.6980158491060138
3866,,2020-01-06,http://web.archive.org/web/20200106044020/https://www.nfl.com/news,Future murky for Patriots after playoff loss to Titans,New England Patriots,-0.9883995573618449
3867,,2020-01-06,http://web.archive.org/web/20200106044020/https://www.nfl.com/news,NFL Research: Henry's historic dominance vs. Pats,New England Patriots,0.8743619320448488
3868,,2020-01-07,http://web.archive.org/web/20200107001009/http://www.espn.com/nfl/,Sources: DC Phillips won't be returning to Rams,Los Angeles Rams,-0.8577287793159485
3869,,2020-01-07,http://web.archive.org/web/20200107001009/http://www.espn.com/nfl/,Source: Cowboys to hire McCarthy as new coach,Dallas Cowboys,0.5795137286186218
3870,,2020-01-07,http://web.archive.org/web/20200107001009/http://www.espn.com/nfl/,Jenkins: Won't go back to Eagles on current deal,Philadelphia Eagles,-0.3099847435951233
3871,,2020-01-07,http://web.archive.org/web/20200107001009/http://www.espn.com/nfl/,Parker retires thanks Chiefs for 'believing in me',Kansas City Chiefs,0.9448603838682175
3872,,2020-01-07,http://web.archive.org/web/20200107001009/http://www.espn.com/nfl/,Kraft: 'Hope and prayer' is Brady returns to Pats,New England Patriots,0.7664011642336845
3876,,2020-01-08,http://web.archive.org/web/20200108004630/https://www.espn.com/nfl/,Sources: Giants to hire Patriots' Judge as coach,New York Giants,0.6559998393058777
3877,,2020-01-08,http://web.archive.org/web/20200108004630/https://www.espn.com/nfl/,Sources: Panthers give Rhule 7-year $60M deal,Carolina Panthers,0.806532010436058
3878,,2020-01-08,http://web.archive.org/web/20200108004630/https://www.espn.com/nfl/,Ravens RB Ingram (calf) sits out practice Tues.,Baltimore Ravens,-0.1744491457939148
3879,,2020-01-08,http://web.archive.org/web/20200108004630/https://www.espn.com/nfl/,Once homeless Raiders' Jacobs buys dad house,Las Vegas Raiders,0.5468147695064545
3880,,2020-01-08,http://web.archive.org/web/20200108004630/https://www.espn.com/nfl/,Source: Redskins have new OC son of ex-coach,Washington Football Team,-0.18253037333488464
3881,,2020-01-08,http://web.archive.org/web/20200108004630/https://www.espn.com/nfl/,Sources: Browns hope to hire coach by Saturday,Cleveland Browns,0.7357127070426941
3882,,2020-01-08,http://web.archive.org/web/20200108045623/http://www.nfl.com/news,Power Rankings: Vikings Titans on the rise heading into the Divisional Round,Minnesota Vikings,0.9613521853461862
3883,,2020-01-09,http://web.archive.org/web/20200109043307/http://www.espn.com/nfl/,Vikes' Thielen suffers ankle injury; Diggs sits out,Minnesota Vikings,-0.6545393019914627
3884,,2020-01-09,http://web.archive.org/web/20200109043307/http://www.espn.com/nfl/,Panthers' Rhule doesn't rule out Newton in '20,Carolina Panthers,0.2985475957393646
3885,,2020-01-09,http://web.archive.org/web/20200109043307/http://www.espn.com/nfl/,Packers QB Rodgers 36 sets sights on 2nd ring,Green Bay Packers,0.8725920543074608
3886,,2020-01-09,http://web.archive.org/web/20200109043307/http://www.espn.com/nfl/,Ravens add depth to O-line with veteran Smith,Baltimore Ravens,0.9339944832026958
3887,,2020-01-10,http://web.archive.org/web/20200110000529/http://www.espn.com/nfl/,Vikes' Thielen questionable with ankle stitches,Minnesota Vikings,-0.8300296291708946
3888,,2020-01-10,http://web.archive.org/web/20200110001825/http://www.nfl.com/news,Will Panthers coach Matt Rhule wear a coaching smock?,Carolina Panthers,0.061585016548633575
3889,,2020-01-10,http://web.archive.org/web/20200110001825/http://www.nfl.com/news,Why the Pats should say goodbye to Brady; plus will Joe Judge set a trend?,New England Patriots,-0.8106109201908112
3890,,2020-01-10,http://web.archive.org/web/20200110001825/http://www.nfl.com/news,Divisional Round game picks: 49ers doomed? Who takes Sunday's juicy QB duels?,San Francisco 49ers,-0.964598199352622
3894,,2020-01-11,http://web.archive.org/web/20200111073856/http://www.espn.com/nfl/,Chiefs DT Jones (calf) listed as questionable,Kansas City Chiefs,-0.8670603455975652
3895,,2020-01-12,http://web.archive.org/web/20200112042251/https://www.espn.com/nfl/,Near full strength 49ers' defense shines in win,San Francisco 49ers,0.9927429545205086
3896,,2020-01-12,http://web.archive.org/web/20200112044655/http://www.nfl.com/news,Healthy 49ers defense steals the show in dominant Divisional Round victory,San Francisco 49ers,0.9452520720660686
3897,,2020-01-12,http://web.archive.org/web/20200112044655/http://www.nfl.com/news,Vikings WR Thielen to 'let it ride' after injury scare,Minnesota Vikings,0.6781028658151627
3900,,2020-01-13,http://web.archive.org/web/20200113010755/http://www.nfl.com/news,Upset Ravens left reeling after Divisional Round loss to Titans,Baltimore Ravens,-0.9624785198830068
3904,,2020-01-13,http://web.archive.org/web/20200113035543/https://www.espn.com/nfl/,Pack led by rookie coach back in NFC title game,Green Bay Packers,0.7621271312236786
3905,,2020-01-13,http://web.archive.org/web/20200113035543/https://www.espn.com/nfl/,Mahomes-inspired Chiefs shatter records in rally,Kansas City Chiefs,0.9802722815657035
3906,,2020-01-13,http://web.archive.org/web/20200113035543/https://www.espn.com/nfl/,Sources: Broncos set to name Shurmur new OC,Denver Broncos,0.6010537147521973
3907,,2020-01-13,http://web.archive.org/web/20200113035543/https://www.espn.com/nfl/,Watson: 'No doubt' O'Brien right coach for Texans,Houston Texans,0.992861584527418
3908,,2020-01-13,http://web.archive.org/web/20200113035543/https://www.espn.com/nfl/,Source: Graham leaving Dolphins to be Giants DC,Miami Dolphins,-0.03692209720611572
3909,,2020-01-13,http://web.archive.org/web/20200113035543/https://www.espn.com/nfl/,Sources: Browns plan to hire Vikes OC Stefanski,Cleveland Browns,0.2881074547767639
3910,,2020-01-14,http://web.archive.org/web/20200114022213/https://www.espn.com/nfl/,Packers to closely dissect Week 12 loss to 49ers,Green Bay Packers,-0.974461599253118
3911,,2020-01-14,http://web.archive.org/web/20200114022213/https://www.espn.com/nfl/,Shanahan expects Playoff Packers to be different,Green Bay Packers,0.5208355262875557
3912,,2020-01-14,http://web.archive.org/web/20200114022213/https://www.espn.com/nfl/,Chiefs' bad-luck fan to steer clear of Titans game,Kansas City Chiefs,-0.9974694489210378
3913,,2020-01-14,http://web.archive.org/web/20200114022213/https://www.espn.com/nfl/,Sources: Nagy Bears hire veteran Lazor as OC,Chicago Bears,0.8280148878693581
3914,,2020-01-14,http://web.archive.org/web/20200114022213/https://www.espn.com/nfl/,Source: Stefanski given 5-year deal with Browns,Cleveland Browns,0.6219491362571716
3915,,2020-01-14,http://web.archive.org/web/20200114022213/https://www.espn.com/nfl/,Jags OC DeFilippo part ways after 1 season,Jacksonville Jaguars,-0.7203700095415115
3916,,2020-01-14,http://web.archive.org/web/20200114040058/https://www.nfl.com/news,Pat Mahomes has message for superstitious Chiefs fan,Kansas City Chiefs,-0.01755823753774166
3917,,2020-01-14,http://web.archive.org/web/20200114040058/https://www.nfl.com/news,Silver: Rodgers' clutch play sends Packers to NFC Championship Game,Green Bay Packers,0.99585000006482
3918,,2020-01-14,http://web.archive.org/web/20200114040058/https://www.nfl.com/news,Chadiha: Everything falling into place in Kansas City,Kansas City Chiefs,0.9983596058445983
3919,,2020-01-15,http://web.archive.org/web/20200115035230/https://www.espn.com/nfl/,Lack of diverse hires concern Steelers' Rooney,Pittsburgh Steelers,-0.9893350427155383
