"Urls","headlines","archiveDate","master_term"
"http://web.archive.org/web/20210306122553/https://www.espn.com/nfl/","Bills give S Hyde two-year contract extension","2021-03-06","Buffalo Bills"
"http://web.archive.org/web/20210306122553/https://www.espn.com/nfl/","Broncos' Simmons gets franchise tag again","2021-03-06","Denver Broncos"
"http://web.archive.org/web/20210306122553/https://www.espn.com/nfl/","DA declines to charge Broncos LB Miller","2021-03-06","Denver Broncos"
"http://web.archive.org/web/20210307030724/https://www.espn.com/nfl/","WFT releases QB Smith after comeback season","2021-03-07","Washington Football Team"
"http://web.archive.org/web/20210307030724/https://www.espn.com/nfl/","Source: Ex-Seahawks C Britt signs with Texans","2021-03-07","Seattle Seahawks"
"http://web.archive.org/web/20210307030724/https://www.espn.com/nfl/","Bengals cut ex-Steelers, Seahawks guard Finney","2021-03-07","Cincinnati Bengals"
"http://web.archive.org/web/20210307030724/https://www.espn.com/nfl/","Bills give S Hyde two-year contract extension","2021-03-07","Buffalo Bills"
"http://web.archive.org/web/20210307030724/https://www.espn.com/nfl/","Broncos' Simmons gets franchise tag again","2021-03-07","Denver Broncos"
"http://web.archive.org/web/20210307030724/https://www.espn.com/nfl/","DA declines to charge Broncos LB Miller","2021-03-07","Denver Broncos"
"http://web.archive.org/web/20210310020317/https://www.espn.com/nfl/","Titans releasing vet cornerback Butler, agent says","2021-03-10","Tennessee Titans"
"http://web.archive.org/web/20210310020317/https://www.espn.com/nfl/","Packers don't place franchise tag on RB Jones","2021-03-10","Green Bay Packers"
"http://web.archive.org/web/20210310020317/https://www.espn.com/nfl/","Sources: LB David stays with Bucs on 2-year deal","2021-03-10","Tampa Bay Buccaneers"
"http://web.archive.org/web/20210310020317/https://www.espn.com/nfl/","Seattle doesn't use tag on RB Carson, CB Griffin","2021-03-10","Seattle Seahawks"
"http://web.archive.org/web/20210310020317/https://www.espn.com/nfl/","Meyer on Doyle exit: Jags didn't need 'distraction'","2021-03-10","Jacksonville Jaguars"
"http://web.archive.org/web/20210310020317/https://www.espn.com/nfl/","Sources: Former Bears lineman Long to unretire","2021-03-10","Chicago Bears"
"http://web.archive.org/web/20210310020317/https://www.espn.com/nfl/","Sources: Pats trade for Brown; don't tag Thuney","2021-03-10","New England Patriots"
"http://web.archive.org/web/20210312035101/https://www.espn.com/nfl/","Bills ink Milano to 4-year, $44M deal, source says","2021-03-12","Buffalo Bills"
"http://web.archive.org/web/20210312035101/https://www.espn.com/nfl/","Line out: Chiefs cut starting OTs Fisher, Schwartz","2021-03-12","Kansas City Chiefs"
"http://web.archive.org/web/20210312035101/https://www.espn.com/nfl/","Saints release Jenkins in latest cost-cutting move","2021-03-12","New Orleans Saints"
"http://web.archive.org/web/20210312035101/https://www.espn.com/nfl/","Bears extend Santos after record-setting season","2021-03-12","Chicago Bears"
"http://web.archive.org/web/20210312035101/https://www.espn.com/nfl/","Texans reach deal with RB Ingram, source says","2021-03-12","Houston Texans"
"http://web.archive.org/web/20210314180757/https://www.espn.com/nfl/","Source: DE Edwards, Bears finalizing 3-year deal","2021-03-14","Chicago Bears"
"http://web.archive.org/web/20210314180757/https://www.espn.com/nfl/","Giants reworking OT Solder's deal, source says","2021-03-14","New York Giants"
"http://web.archive.org/web/20210314180757/https://www.espn.com/nfl/","Bills safety Poyer says he's one year sober","2021-03-14","Buffalo Bills"
"http://web.archive.org/web/20210314180757/https://www.espn.com/nfl/","Sources: Chiefs to restructure Mahomes' contract","2021-03-14","Kansas City Chiefs"
"http://web.archive.org/web/20210314180757/https://www.espn.com/nfl/","Tampa extends Brady; $19M saved, sources say","2021-03-14","Tampa Bay Buccaneers"
"http://web.archive.org/web/20210314180757/https://www.espn.com/nfl/","Sources: Fins get Texans' McKinney for Lawson","2021-03-14","Miami Dolphins"
"http://web.archive.org/web/20210315023548/https://www.espn.com/nfl/","Source: 49ers sign Juszczyk to 5-year, $27M deal","2021-03-15","San Francisco 49ers"
"http://web.archive.org/web/20210315023548/https://www.espn.com/nfl/","Packers keep RB Jones with 4-year, $48M deal","2021-03-15","Green Bay Packers"
"http://web.archive.org/web/20210315023548/https://www.espn.com/nfl/","Sources: Texans acquire RT Cannon from Pats","2021-03-15","Houston Texans"
"http://web.archive.org/web/20210315023548/https://www.espn.com/nfl/","Sources: Fins get Texans' McKinney for Lawson","2021-03-15","Miami Dolphins"
"http://web.archive.org/web/20210315023548/https://www.espn.com/nfl/","Source: DE Edwards, Bears finalizing 3-year deal","2021-03-15","Chicago Bears"
"http://web.archive.org/web/20210315023548/https://www.espn.com/nfl/","Saint goes marching out: Brees retires from NFL","2021-03-15","New Orleans Saints"
"http://web.archive.org/web/20210316092246/https://www.espn.com/nfl/","Gronkowski returning to Bucs on 1-year contract","2021-03-16","Tampa Bay Buccaneers"
"http://web.archive.org/web/20210316092246/https://www.espn.com/nfl/","Source: Pats get 2-year, $26M deal with Agholor","2021-03-16","New England Patriots"
"http://web.archive.org/web/20210316092246/https://www.espn.com/nfl/","Source: Winston back with Saints for 1 year, $12M","2021-03-16","New Orleans Saints"
"http://web.archive.org/web/20210316092246/https://www.espn.com/nfl/","Source: Bengals reach deal with Hendrickson","2021-03-16","Cincinnati Bengals"
"http://web.archive.org/web/20210316092246/https://www.espn.com/nfl/","Vikes boost run defense, add ex-Giant Tomlinson","2021-03-16","Minnesota Vikings"
"http://web.archive.org/web/20210316092246/https://www.espn.com/nfl/","QB Fitzpatrick strikes deal with WFT, source says","2021-03-16","Washington Football Team"
"http://web.archive.org/web/20210317162230/https://www.espn.com/nfl/","Source: Bucs settle tag grievance with Barrett","2021-03-17","Tampa Bay Buccaneers"
"http://web.archive.org/web/20210317162230/https://www.espn.com/nfl/","Source: Raiders, ex-Bills WR Brown reach deal","2021-03-17","Las Vegas Raiders"
"http://web.archive.org/web/20210317162230/https://www.espn.com/nfl/","Source: Dolphins add to CB depth with Coleman","2021-03-17","Miami Dolphins"
"http://web.archive.org/web/20210317162230/https://www.espn.com/nfl/","Sources: Bears turn to Dalton after Wilson pursuit","2021-03-17","Chicago Bears"
"http://web.archive.org/web/20210317162230/https://www.espn.com/nfl/","Deep at RB, Chiefs cut Super Bowl hero Williams","2021-03-17","Kansas City Chiefs"
"http://web.archive.org/web/20210317162230/https://www.espn.com/nfl/","Williams stays with 49ers on historic $138M deal","2021-03-17","San Francisco 49ers"
"http://web.archive.org/web/20210318180530/https://www.espn.com/nfl/","Source: Chargers fill Henry void with TE Cook","2021-03-18","Los Angeles Chargers"
"http://web.archive.org/web/20210318180530/https://www.espn.com/nfl/","Cardinals' Green: 'Lot left in the tank' at age 32","2021-03-18","Arizona Cardinals"
"http://web.archive.org/web/20210318180530/https://www.espn.com/nfl/","Pats' Chung reverses course, decides to retire","2021-03-18","New England Patriots"
"http://web.archive.org/web/20210318180530/https://www.espn.com/nfl/","$225K bail set for man who shot ex-Saint Smith","2021-03-18","New Orleans Saints"
"http://web.archive.org/web/20210318180530/https://www.espn.com/nfl/","Broncos, tailback Lindsay decide to part ways","2021-03-18","Denver Broncos"
"http://web.archive.org/web/20210319012901/https://www.espn.com/nfl/","Source: Bears cut Fuller; WR Robinson signs tag","2021-03-19","Chicago Bears"
"http://web.archive.org/web/20210319012901/https://www.espn.com/nfl/","Source: CB Hill signing $24M deal with Browns","2021-03-19","Cleveland Browns"
"http://web.archive.org/web/20210319012901/https://www.espn.com/nfl/","Dalton says Bears told him starting QB job is his","2021-03-19","Chicago Bears"
"http://web.archive.org/web/20210319012901/https://www.espn.com/nfl/","49ers sign Pro Bowl center Mack to 3-year deal","2021-03-19","San Francisco 49ers"
"http://web.archive.org/web/20210319012901/https://www.espn.com/nfl/","Broncos GM on keeping Miller: 'Still had juice'","2021-03-19","Denver Broncos"
"http://web.archive.org/web/20210319012901/https://www.espn.com/nfl/","Source: OL Pocic expected to return to Seattle","2021-03-19","Seattle Seahawks"
"http://web.archive.org/web/20210321004843/https://www.espn.com/nfl/","Giants add a No. 1 WR in 'playmaker' Golladay","2021-03-21","New York Giants"
"http://web.archive.org/web/20210321004843/https://www.espn.com/nfl/","Dolphins waive OT Wilson days after trade","2021-03-21","Miami Dolphins"
"http://web.archive.org/web/20210321004843/https://www.espn.com/nfl/","Source: Colts, CB Rhodes agree on 1-year pact","2021-03-21","Indianapolis Colts"
"http://web.archive.org/web/20210321004843/https://www.espn.com/nfl/","Safety Neal, Cowboys agree to 1-year deal","2021-03-21","Dallas Cowboys"
"http://web.archive.org/web/20210321004843/https://www.espn.com/nfl/","Saints lose 6th-round pick for COVID violations","2021-03-21","New Orleans Saints"
"http://web.archive.org/web/20210321004843/https://www.espn.com/nfl/","Source: Broncos, CB Fuller agree to one-year deal","2021-03-21","Denver Broncos"
"http://web.archive.org/web/20210322020356/https://www.espn.com/nfl/","Jets bolster D-line with DT Rankins, source says","2021-03-22","New York Jets"
"http://web.archive.org/web/20210322020356/https://www.espn.com/nfl/","Giants add a No. 1 WR in 'playmaker' Golladay","2021-03-22","New York Giants"
"http://web.archive.org/web/20210322020356/https://www.espn.com/nfl/","Infant son of Browns' Switzer hospitalized again","2021-03-22","Cleveland Browns"
"http://web.archive.org/web/20210322020356/https://www.espn.com/nfl/","Broncos agree to deal with ex-Bears CB Fuller","2021-03-22","Denver Broncos"
"http://web.archive.org/web/20210322020356/https://www.espn.com/nfl/","Dolphins waive OT Wilson days after trade","2021-03-22","Miami Dolphins"
"http://web.archive.org/web/20210322020356/https://www.espn.com/nfl/","Rams add DeSean to Stafford's stable of targets","2021-03-22","Los Angeles Rams"
"http://web.archive.org/web/20210324044515/https://www.espn.com/nfl/","Flacco signing deal with Eagles to back up Hurts","2021-03-24","Philadelphia Eagles"
"http://web.archive.org/web/20210324044515/https://www.espn.com/nfl/","WFT prez says name could stick, cites fan input","2021-03-24","Washington Football Team"
"http://web.archive.org/web/20210324044515/https://www.espn.com/nfl/","Williams: Near Chiefs deal before 49ers return","2021-03-24","Kansas City Chiefs"
"http://web.archive.org/web/20210324044515/https://www.espn.com/nfl/","Sources: Seahawks sign Hyder, re-sign Mayowa","2021-03-24","Seattle Seahawks"
"http://web.archive.org/web/20210324044515/https://www.espn.com/nfl/","Saints' Winston emotional over Brees' impact","2021-03-24","New Orleans Saints"
"http://web.archive.org/web/20210324044515/https://www.espn.com/nfl/","CB Nelson asks for, granted release by Steelers","2021-03-24","Pittsburgh Steelers"
"http://web.archive.org/web/20210325072257/https://www.espn.com/nfl/","Source: Cowboys tell Smith that he won't return","2021-03-25","Dallas Cowboys"
"http://web.archive.org/web/20210325072257/https://www.espn.com/nfl/","WR Hilton returns to Colts on 1-year, $10M deal","2021-03-25","Indianapolis Colts"
"http://web.archive.org/web/20210325072257/https://www.espn.com/nfl/","Pats' Herron honored for helping stop sex assault","2021-03-25","New England Patriots"
"http://web.archive.org/web/20210325072257/https://www.espn.com/nfl/","Ex-Titan Wilson charged after high-speed chase","2021-03-25","Tennessee Titans"
"http://web.archive.org/web/20210325072257/https://www.espn.com/nfl/","Texans promote Grissom to team president","2021-03-25","Houston Texans"
"http://web.archive.org/web/20210325072257/https://www.espn.com/nfl/","Ex-Chiefs RB Williams to join Bears, source says","2021-03-25","Kansas City Chiefs"
"http://web.archive.org/web/20210325072257/https://www.espn.com/nfl/","NFL clears way for Snyder to buy out WFT owners","2021-03-25","Washington Football Team"
"http://web.archive.org/web/20210326021800/http://www.espn.com/nfl/","NFL clears way for Snyder to buy out WFT owners","2021-03-26","Washington Football Team"
"http://web.archive.org/web/20210326021800/http://www.espn.com/nfl/","Source: Cowboys tell Smith that he won't return","2021-03-26","Dallas Cowboys"
"http://web.archive.org/web/20210326021800/http://www.espn.com/nfl/","WR Hilton returns to Colts on 1-year, $10M deal","2021-03-26","Indianapolis Colts"
"http://web.archive.org/web/20210326021800/http://www.espn.com/nfl/","Source: RB Coleman 1st 49er to join Saleh's Jets","2021-03-26","New York Jets"
"http://web.archive.org/web/20210326021800/http://www.espn.com/nfl/","Ex-Titan Wilson charged after high-speed chase","2021-03-26","Tennessee Titans"
"http://web.archive.org/web/20210326021800/http://www.espn.com/nfl/","Texans promote Grissom to team president","2021-03-26","Houston Texans"
"http://web.archive.org/web/20210326021800/http://www.espn.com/nfl/","Cardinals sign CB Butler to one-year deal","2021-03-26","Arizona Cardinals"
"http://web.archive.org/web/20210327131429/https://www.espn.com/nfl/","In case it wasn't clear, Miami Dolphins are all-in on Tua Tagovailoa for 2021","2021-03-27","Miami Dolphins"
"http://web.archive.org/web/20210328095958/https://www.espn.com/nfl/","Fins deal No. 3 pick to 49ers, get Eagles' No. 6","2021-03-28","Miami Dolphins"
"http://web.archive.org/web/20210328095958/https://www.espn.com/nfl/","Sources: Ravens add Watkins as WR hunt ends","2021-03-28","Baltimore Ravens"
"http://web.archive.org/web/20210328095958/https://www.espn.com/nfl/","Source: Vikings, safety Woods reach 1-year deal","2021-03-28","Minnesota Vikings"
"http://web.archive.org/web/20210328095958/https://www.espn.com/nfl/","Saints' Lattimore arrested for loaded, stolen gun","2021-03-28","New Orleans Saints"
"http://web.archive.org/web/20210328095958/https://www.espn.com/nfl/","Source: Fournette agrees; all Bucs starters back","2021-03-28","Tampa Bay Buccaneers"
"http://web.archive.org/web/20210328095958/https://www.espn.com/nfl/","49ers' Givens charged with beating man at hotel","2021-03-28","San Francisco 49ers"
"http://web.archive.org/web/20210328095958/https://www.espn.com/nfl/","Source: DT Alualu chooses Steelers, not Jaguars","2021-03-28","Pittsburgh Steelers"
"http://web.archive.org/web/20210331000513/https://www.espn.com/nfl/","Sources: Seattle's Jackson gets deal after trade","2021-03-31","Seattle Seahawks"
"http://web.archive.org/web/20210331000513/https://www.espn.com/nfl/","Texans GM: Watson lawsuits 'certainly troubling'","2021-03-31","Houston Texans"
"http://web.archive.org/web/20210331000513/https://www.espn.com/nfl/","Source: Raiders sign LT Miller to 3-year extension","2021-03-31","Las Vegas Raiders"
"http://web.archive.org/web/20210331000513/https://www.espn.com/nfl/","Source: Chiefs agree to 1-year deal with Blythe","2021-03-31","Kansas City Chiefs"
"http://web.archive.org/web/20210402070511/https://www.espn.com/nfl/","Spanos' sister asks court to force Chargers sale","2021-04-02","Los Angeles Chargers"
"http://web.archive.org/web/20210402070511/https://www.espn.com/nfl/","Falcons set to play game in London this season","2021-04-02","Atlanta Falcons"
"http://web.archive.org/web/20210402070511/https://www.espn.com/nfl/","Rivera on WFT QBs: 'There will be a competition'","2021-04-02","Washington Football Team"
"http://web.archive.org/web/20210410073340/http://www.espn.com/nfl/","Seahawks re-sign Randall, moving him to CB","2021-04-10","Seattle Seahawks"
"http://web.archive.org/web/20210410073340/http://www.espn.com/nfl/","WFT releases TE Moss, son of Hall of Famer","2021-04-10","Washington Football Team"
"http://web.archive.org/web/20210410073340/http://www.espn.com/nfl/","Panthers add secondary help with Bouye deal","2021-04-10","Carolina Panthers"
"http://web.archive.org/web/20210412024131/https://www.espn.com/nfl/","Seahawks re-sign Randall, moving him to CB","2021-04-12","Seattle Seahawks"
"http://web.archive.org/web/20210412024131/https://www.espn.com/nfl/","WFT releases TE Moss, son of Hall of Famer","2021-04-12","Washington Football Team"
"http://web.archive.org/web/20210412024131/https://www.espn.com/nfl/","Sources: Titans great George to coach Tenn. St.","2021-04-12","Tennessee Titans"
"http://web.archive.org/web/20210413014047/https://www.espn.com/nfl/","Patriots WR Edelman, 34, announces retirement","2021-04-13","New England Patriots"
"http://web.archive.org/web/20210413014047/https://www.espn.com/nfl/","Source: Bernard agrees to deal with Buccaneers","2021-04-13","Tampa Bay Buccaneers"
"http://web.archive.org/web/20210413014047/https://www.espn.com/nfl/","Moss reunites with Burrow, lands with Cincinnati","2021-04-13","Cincinnati Bengals"
"http://web.archive.org/web/20210413014047/https://www.espn.com/nfl/","Sources: Titans great George to coach Tenn. St.","2021-04-13","Tennessee Titans"
"http://web.archive.org/web/20210413014047/https://www.espn.com/nfl/","Ex-Chiefs assistant Reid charged with felony DWI","2021-04-13","Kansas City Chiefs"
"http://web.archive.org/web/20210414013129/https://www.espn.com/nfl/","Denver, Seattle, Bucs to skip voluntary workouts","2021-04-14","Denver Broncos"
"http://web.archive.org/web/20210414013129/https://www.espn.com/nfl/","Cardinals sign ex-Steelers running back Conner","2021-04-14","Arizona Cardinals"
"http://web.archive.org/web/20210414013129/https://www.espn.com/nfl/","Washington signs hoops-to-TE hopeful Reyes","2021-04-14","Washington Football Team"
"http://web.archive.org/web/20210414013129/https://www.espn.com/nfl/","Ex-Chiefs assistant Reid charged with felony DWI","2021-04-14","Kansas City Chiefs"
"http://web.archive.org/web/20210414013129/https://www.espn.com/nfl/","Patriots WR Edelman, 34, announces retirement","2021-04-14","New England Patriots"
"http://web.archive.org/web/20210417085343/https://www.espn.com/nfl/","Bears sign wide receiver Goodwin to 1-year deal","2021-04-17","Chicago Bears"
"http://web.archive.org/web/20210417085343/https://www.espn.com/nfl/","Patriots CB Jackson signs tender after breakout","2021-04-17","New England Patriots"
"http://web.archive.org/web/20210417085343/https://www.espn.com/nfl/","Browns cut starter Richardson, save $11M vs. cap","2021-04-17","Cleveland Browns"
"http://web.archive.org/web/20210417085343/https://www.espn.com/nfl/","Steelers, Falcons among teams skipping workouts","2021-04-17","Pittsburgh Steelers"
"http://web.archive.org/web/20210417085343/https://www.espn.com/nfl/","Attorney: Client mistook Rams' Donald for attacker","2021-04-17","Los Angeles Rams"
"http://web.archive.org/web/20210418172923/https://www.espn.com/nfl/","Bears sign wide receiver Goodwin to 1-year deal","2021-04-18","Chicago Bears"
"http://web.archive.org/web/20210418172923/https://www.espn.com/nfl/","Browns cut starter Richardson, save $11M vs. cap","2021-04-18","Cleveland Browns"
"http://web.archive.org/web/20210418172923/https://www.espn.com/nfl/","Attorney: Client mistook Rams' Donald for attacker","2021-04-18","Los Angeles Rams"
"http://web.archive.org/web/20210419001052/https://www.espn.com/nfl/","Attorney: Client mistook Rams' Donald for attacker","2021-04-19","Los Angeles Rams"
"http://web.archive.org/web/20210419001052/https://www.espn.com/nfl/","Lawrence to give $20K to Jacksonville charities","2021-04-19","Jacksonville Jaguars"
"http://web.archive.org/web/20210419001052/https://www.espn.com/nfl/","Bears sign wide receiver Goodwin to 1-year deal","2021-04-19","Chicago Bears"
"http://web.archive.org/web/20210419001052/https://www.espn.com/nfl/","Chiefs great, local politician Arbanas dies at 82","2021-04-19","Kansas City Chiefs"
"http://web.archive.org/web/20210421014229/https://www.espn.com/nfl/","Raiders face backlash for 'I can breathe' tweet","2021-04-21","Las Vegas Raiders"
"http://web.archive.org/web/20210421014229/https://www.espn.com/nfl/","Bills GM confident of Allen deal, but 'no rush'","2021-04-21","Buffalo Bills"
"http://web.archive.org/web/20210421014229/https://www.espn.com/nfl/","Steelers give Tomlin 3-year contract extension","2021-04-21","Pittsburgh Steelers"
"http://web.archive.org/web/20210422000011/https://www.espn.com/nfl/","Floyd's brother backs Raiders after tweet uproar","2021-04-22","Las Vegas Raiders"
"http://web.archive.org/web/20210422000011/https://www.espn.com/nfl/","Antonio Brown settles dispute with ex-trainer","2021-04-22","Cleveland Browns"
"http://web.archive.org/web/20210422000011/https://www.espn.com/nfl/","Video of Saints CB Lattimore's arrest released","2021-04-22","New Orleans Saints"
"http://web.archive.org/web/20210422000011/https://www.espn.com/nfl/","T.J. Ward, part of Broncos' 'No Fly Zone,' retires","2021-04-22","Denver Broncos"
"http://web.archive.org/web/20210424044255/https://www.espn.com/nfl/","Lions open to trading No. 7 pick in NFL draft","2021-04-24","Detroit Lions"
"http://web.archive.org/web/20210424044255/https://www.espn.com/nfl/","Steelers CB Layne arrested, faces felony charge","2021-04-24","Pittsburgh Steelers"
"http://web.archive.org/web/20210424044255/https://www.espn.com/nfl/","Bears legend McMichael reveals ALS diagnosis","2021-04-24","Chicago Bears"
"http://web.archive.org/web/20210424044255/https://www.espn.com/nfl/","Browns lock in Mayfield for 2022 at $18.8M","2021-04-24","Cleveland Browns"
"http://web.archive.org/web/20210424044255/https://www.espn.com/nfl/","Panthers 'very open' to moving back from No. 8","2021-04-24","Carolina Panthers"
"http://web.archive.org/web/20210424044255/https://www.espn.com/nfl/","Chiefs acquire OT Brown in trade with Ravens","2021-04-24","Kansas City Chiefs"
"http://web.archive.org/web/20210425012756/https://www.espn.com/nfl/","Lions open to trading No. 7 pick in NFL draft","2021-04-25","Detroit Lions"
"http://web.archive.org/web/20210425012756/https://www.espn.com/nfl/","Steelers CB Layne arrested, faces felony charge","2021-04-25","Pittsburgh Steelers"
"http://web.archive.org/web/20210425012756/https://www.espn.com/nfl/","Bears legend McMichael reveals ALS diagnosis","2021-04-25","Chicago Bears"
"http://web.archive.org/web/20210425012756/https://www.espn.com/nfl/","Browns lock in Mayfield for 2022 at $18.8M","2021-04-25","Cleveland Browns"
"http://web.archive.org/web/20210425012756/https://www.espn.com/nfl/","Panthers 'very open' to moving back from No. 8","2021-04-25","Carolina Panthers"
"http://web.archive.org/web/20210425012756/https://www.espn.com/nfl/","Chiefs acquire OT Brown in trade with Ravens","2021-04-25","Kansas City Chiefs"
"http://web.archive.org/web/20210427064846/https://www.espn.com/nfl/","Falcons would listen to offers for Julio, says GM","2021-04-27","Atlanta Falcons"
"http://web.archive.org/web/20210427064846/https://www.espn.com/nfl/","GM: Rodgers Pack's QB for 'foreseeable future'","2021-04-27","Green Bay Packers"
"http://web.archive.org/web/20210427064846/https://www.espn.com/nfl/","Vikings CB Peterson says he'll wear No. 7 in '21","2021-04-27","Minnesota Vikings"
"http://web.archive.org/web/20210427064846/https://www.espn.com/nfl/","Browns' Mayfield focused on wins, not extension","2021-04-27","Cleveland Browns"
"http://web.archive.org/web/20210427064846/https://www.espn.com/nfl/","Chiefs' Brown happy at LT, protecting Mahomes","2021-04-27","Kansas City Chiefs"
"http://web.archive.org/web/20210427064846/https://www.espn.com/nfl/","49ers like five QBs as fit with No. 3 overall pick","2021-04-27","San Francisco 49ers"
"http://web.archive.org/web/20210430085852/https://www.espn.com/nfl/","Bears 'execute' plan, draft QB Fields after trade","2021-04-30","Chicago Bears"
"http://web.archive.org/web/20210430085852/https://www.espn.com/nfl/","Pats get Bama's Jones; Belichick: 'Cam's our QB'","2021-04-30","New England Patriots"
"http://web.archive.org/web/20210430085852/https://www.espn.com/nfl/","Jags take ex-Clemson stars Lawrence, Etienne","2021-04-30","Jacksonville Jaguars"
"http://web.archive.org/web/20210430085852/https://www.espn.com/nfl/","Rams GM Snead tests positive for COVID-19","2021-04-30","Los Angeles Rams"
"http://web.archive.org/web/20210430085852/https://www.espn.com/nfl/","Niners take QB Lance but want Jimmy G to stay","2021-04-30","San Francisco 49ers"
"http://web.archive.org/web/20210430085852/https://www.espn.com/nfl/","Eagles trade up with Dallas, get Bama WR Smith","2021-04-30","Philadelphia Eagles"
"http://web.archive.org/web/20210430085852/https://www.espn.com/nfl/","GM: Pack 'committed' to Rodgers, not trading him","2021-04-30","Green Bay Packers"
"http://web.archive.org/web/20210501102642/https://www.espn.com/nfl/","Rodgers to Rodgers? Pack add WR for miffed QB","2021-05-01","Green Bay Packers"
"http://web.archive.org/web/20210501102642/https://www.espn.com/nfl/","'Trader Dave': Giants GM bucks trend with deals","2021-05-01","New York Giants"
"http://web.archive.org/web/20210501102642/https://www.espn.com/nfl/","Vikes get potential Cousins successor in QB Mond","2021-05-01","Minnesota Vikings"
"http://web.archive.org/web/20210501102642/https://www.espn.com/nfl/","Back to the well: Pats draft Alabama's Barmore","2021-05-01","New England Patriots"
"http://web.archive.org/web/20210501102642/https://www.espn.com/nfl/","Rams use 1st pick on small but speedy WR Atwell","2021-05-01","Los Angeles Rams"
"http://web.archive.org/web/20210501102642/https://www.espn.com/nfl/","Heir apparent? Bucs draft Trask as Brady backup","2021-05-01","Tampa Bay Buccaneers"
"http://web.archive.org/web/20210502061630/https://www.espn.com/nfl/","Stuard faced hard road to be Bucs' Mr. Irrelevant","2021-05-02","Tampa Bay Buccaneers"
