"Urls","headlines","archiveDate","master_term"
"http://web.archive.org/web/20190417041053/http://www.espn.com/nfl/","Cowboys options for Dak Prescott on heels of Russell Wilsons deal","2019-04-17","Dallas Cowboys"
"http://web.archive.org/web/20190418012613/http://espn.com/NFL","AB's Raiders, Flacco's Broncos help kick off MNF","2019-04-18","Las Vegas Raiders"
"http://web.archive.org/web/20190418012613/http://espn.com/NFL","Wilson eyeing next decade after Seahawks deal","2019-04-18","Seattle Seahawks"
"http://web.archive.org/web/20190418012613/http://espn.com/NFL","Bears, Raiders to play at new Tottenham stadium","2019-04-18","Chicago Bears"
"http://web.archive.org/web/20190419025219/http://www.espn.com/nfl/","Giants target best players: 'Can't draft for need'","2019-04-19","New York Giants"
"http://web.archive.org/web/20190419025219/http://www.espn.com/nfl/","Lions GM: Underclassmen getting 'bad' draft info","2019-04-19","Detroit Lions"
"http://web.archive.org/web/20190419025219/http://www.espn.com/nfl/","Redskins keep DL intact with Ioannidis extension","2019-04-19","Washington Football Team"
"http://web.archive.org/web/20190423012621/http://www.espn.com/nfl/","Bills add former Jags RB Yeldon to backfield","2019-04-23","Buffalo Bills"
"http://web.archive.org/web/20190423012621/http://www.espn.com/nfl/","Source: Seahawks want 1st-rounder for DE Clark","2019-04-23","Seattle Seahawks"
"http://web.archive.org/web/20190424025216/http://www.espn.com/nfl/","Sources: Clark dealt to Chiefs, has $105.5M deal","2019-04-24","Kansas City Chiefs"
"http://web.archive.org/web/20190424025216/http://www.espn.com/nfl/","Source: Suspended Gordon signs Patriots tender","2019-04-24","New England Patriots"
"http://web.archive.org/web/20190424025216/http://www.espn.com/nfl/","Back with Pack, Madison says 'life was on the line'","2019-04-24","Green Bay Packers"
"http://web.archive.org/web/20190424025216/http://www.espn.com/nfl/","Kicker Gould ditches talks, wants off 49ers","2019-04-24","San Francisco 49ers"
"http://web.archive.org/web/20190424025216/http://www.espn.com/nfl/","OBJ doesn't hold back in rant against Giants","2019-04-24","New York Giants"
"http://web.archive.org/web/20190425105536/http://espn.com:80/nfl","Bucs to pick up option on CB Hargreaves","2019-04-25","Tampa Bay Buccaneers"
"http://web.archive.org/web/20190425105536/http://espn.com:80/nfl","Blind fan, 13, to read Ravens' pick off Braille card","2019-04-25","Baltimore Ravens"
"http://web.archive.org/web/20190425105536/http://espn.com:80/nfl","Robison retires after signing 1-day Vikes deal","2019-04-25","Minnesota Vikings"
"http://web.archive.org/web/20190428111809/http://www.espn.com/nfl/","Chairman: Chiefs will make 'right decision' on Hill","2019-04-28","Kansas City Chiefs"
"http://web.archive.org/web/20190428111809/http://www.espn.com/nfl/","Cards' pick Wilson embraces Mr. Irrelevant status","2019-04-28","Arizona Cardinals"
"http://web.archive.org/web/20190428111809/http://www.espn.com/nfl/","Bucs GM defends picking 2nd kicker in 4 drafts","2019-04-28","Tampa Bay Buccaneers"
"http://web.archive.org/web/20190428111809/http://www.espn.com/nfl/","Shades of Brady: Pats' Stidham 7th QB selected","2019-04-28","New England Patriots"
"http://web.archive.org/web/20190428111809/http://www.espn.com/nfl/","Seahawks pick coached in hoops by Wilson as kid","2019-04-28","Seattle Seahawks"
"http://web.archive.org/web/20190428111809/http://www.espn.com/nfl/","Allen's 'Last Chance' story continues as a Ram","2019-04-28","Los Angeles Rams"
"http://web.archive.org/web/20190429103101/http://www.espn.com/nfl/","Ex-Raiders K Janikowski retiring after 19 seasons","2019-04-29","Las Vegas Raiders"
"http://web.archive.org/web/20190429103101/http://www.espn.com/nfl/","Washburn DB killed, Giants pick hurt in shooting","2019-04-29","New York Giants"
"http://web.archive.org/web/20190429103101/http://www.espn.com/nfl/","Giants GM: 2 teams would pick Jones by No. 17","2019-04-29","New York Giants"
"http://web.archive.org/web/20190429103101/http://www.espn.com/nfl/","Cowboys to sign Hall of Famer Larry Allen's son","2019-04-29","Dallas Cowboys"
"http://web.archive.org/web/20190429103101/http://www.espn.com/nfl/","Flores: Rosen has to earn Dolphins' starting job","2019-04-29","Miami Dolphins"
"http://web.archive.org/web/20190429103101/http://www.espn.com/nfl/","Allen's 'Last Chance' story continues as a Ram","2019-04-29","Los Angeles Rams"
"http://web.archive.org/web/20190503233433/http://www.espn.com/nfl/","No good: Bears kickers boot early shot to dazzle","2019-05-03","Chicago Bears"
"http://web.archive.org/web/20190503233433/http://www.espn.com/nfl/","Source: Jets decline 2020 option for LB Lee","2019-05-03","New York Jets"
"http://web.archive.org/web/20190503233433/http://www.espn.com/nfl/","Bucs' JPP released from hospital after accident","2019-05-03","Tampa Bay Buccaneers"
"http://web.archive.org/web/20190504074857/http://www.espn.com/nfl/","No good: Bears kickers boot early shot to dazzle","2019-05-04","Chicago Bears"
"http://web.archive.org/web/20190504074857/http://www.espn.com/nfl/","Packers top pick Gary debuts in shoulder brace","2019-05-04","Green Bay Packers"
"http://web.archive.org/web/20190504074857/http://www.espn.com/nfl/","Giants 'hopeful' Ballentine reports for workouts","2019-05-04","New York Giants"
"http://web.archive.org/web/20190504074857/http://www.espn.com/nfl/","Source: Jets decline 2020 option for LB Lee","2019-05-04","New York Jets"
"http://web.archive.org/web/20190505003443/http://www.espn.com/nfl/","Giants' Shurmur: Eli is 'staying in the moment'","2019-05-05","New York Giants"
"http://web.archive.org/web/20190505003443/http://www.espn.com/nfl/","Son of ex-NFL WR Horn has tryout with Ravens","2019-05-05","Baltimore Ravens"
"http://web.archive.org/web/20190505003443/http://www.espn.com/nfl/","Giants QB Jones focusing on offense, not critics","2019-05-05","New York Giants"
"http://web.archive.org/web/20190505003443/http://www.espn.com/nfl/","No good: Bears kickers boot early shot to dazzle","2019-05-05","Chicago Bears"
"http://web.archive.org/web/20190505003443/http://www.espn.com/nfl/","Packers top pick Gary debuts in shoulder brace","2019-05-05","Green Bay Packers"
"http://web.archive.org/web/20190506012947/http://www.espn.com/nfl/","Giants' Shurmur: Eli is 'staying in the moment'","2019-05-06","New York Giants"
"http://web.archive.org/web/20190506012947/http://www.espn.com/nfl/","Son of ex-NFL WR Horn has tryout with Ravens","2019-05-06","Baltimore Ravens"
"http://web.archive.org/web/20190506012947/http://www.espn.com/nfl/","Giants QB Jones focusing on offense, not critics","2019-05-06","New York Giants"
"http://web.archive.org/web/20190506012947/http://www.espn.com/nfl/","No good: Bears kickers boot early shot to dazzle","2019-05-06","Chicago Bears"
"http://web.archive.org/web/20190506012947/http://www.espn.com/nfl/","Packers top pick Gary debuts in shoulder brace","2019-05-06","Green Bay Packers"
"http://web.archive.org/web/20190507020235/http://www.espn.com/nfl/","Sources: Bears trade for Raiders kicker Pineiro","2019-05-07","Chicago Bears"
"http://web.archive.org/web/20190507020235/http://www.espn.com/nfl/","Bucs' McCoy responds to those calling him out","2019-05-07","Tampa Bay Buccaneers"
"http://web.archive.org/web/20190507020235/http://www.espn.com/nfl/","Redskins' Keenum 'excited' to work with Haskins","2019-05-07","Washington Football Team"
"http://web.archive.org/web/20190508023257/http://www.espn.com/nfl/","OBJ's aim: Turn Browns into 'the new Patriots'","2019-05-08","Cleveland Browns"
"http://web.archive.org/web/20190508023257/http://www.espn.com/nfl/","Source: Patriots to sign veteran OT Veldheer","2019-05-08","New England Patriots"
"http://web.archive.org/web/20190509030842/http://www.espn.com/nfl/","Cowboys engaged in talks with Prescott, Cooper","2019-05-09","Dallas Cowboys"
"http://web.archive.org/web/20190509030842/http://www.espn.com/nfl/","Ex-Packers GM Thompson reveals health issues","2019-05-09","Green Bay Packers"
"http://web.archive.org/web/20190510035920/http://www.espn.com/nfl/","Jaguars LB Smith says he won't play in 2019","2019-05-10","Jacksonville Jaguars"
"http://web.archive.org/web/20190510035920/http://www.espn.com/nfl/","Patriots' Edelman to graduate from Kent State","2019-05-10","New England Patriots"
"http://web.archive.org/web/20190510035920/http://www.espn.com/nfl/","Browns' OBJ clarifies 'new Patriots' comment","2019-05-10","Cleveland Browns"
"http://web.archive.org/web/20190510035920/http://www.espn.com/nfl/","Source: TE Watson to join Pats on one-year deal","2019-05-10","New England Patriots"
"http://web.archive.org/web/20190510035920/http://www.espn.com/nfl/","Seahawks move on from Baldwin, Chancellor","2019-05-10","Seattle Seahawks"
"http://web.archive.org/web/20190513061318/http://www.espn.com/nfl/","Ex-Seahawks WR Baldwin indicates he's retiring","2019-05-13","Seattle Seahawks"
"http://web.archive.org/web/20190513061318/http://www.espn.com/nfl/","Eagles to add Kessler to QB mix, source says","2019-05-13","Philadelphia Eagles"
"http://web.archive.org/web/20190513061318/http://www.espn.com/nfl/","O-line revamp: Giants, RT Remmers agree to deal","2019-05-13","New York Giants"
"http://web.archive.org/web/20190513061318/http://www.espn.com/nfl/","Haskins turning heads at Redskins minicamp","2019-05-13","Washington Football Team"
"http://web.archive.org/web/20190513061318/http://www.espn.com/nfl/","New cleats a pain for Murray in 1st Cards practice","2019-05-13","Arizona Cardinals"
"http://web.archive.org/web/20190516082204/http://www.espn.com/nfl/","Jets fire GM Maccagnan, name Gase interim","2019-05-16","New York Jets"
"http://web.archive.org/web/20190516082204/http://www.espn.com/nfl/","Browns' Hunt: 'I am not going to mess this up'","2019-05-16","Cleveland Browns"
"http://web.archive.org/web/20190516082204/http://www.espn.com/nfl/","Source: Free-agent LB Collins returns to Patriots","2019-05-16","New England Patriots"
"http://web.archive.org/web/20190516082204/http://www.espn.com/nfl/","Falcons' Brown pays costs for infant's funeral","2019-05-16","Atlanta Falcons"
"http://web.archive.org/web/20190518093417/http://www.espn.com/nfl/","Cards' Peterson 'definitely sorry' for PED violation","2019-05-18","Arizona Cardinals"
"http://web.archive.org/web/20190518093417/http://www.espn.com/nfl/","Ravens sign LB Ray, WR Floyd to help fill voids","2019-05-18","Baltimore Ravens"
"http://web.archive.org/web/20190518093417/http://www.espn.com/nfl/","Big Ben hosts Steelers' skill players at lake house","2019-05-18","Pittsburgh Steelers"
"http://web.archive.org/web/20190520103547/http://www.espn.com/nfl/","Eagles' Long says he's retiring after 11 seasons","2019-05-20","Philadelphia Eagles"
"http://web.archive.org/web/20190520103547/http://www.espn.com/nfl/","Source: Texans release TE Griffin after April arrest","2019-05-20","Houston Texans"
"http://web.archive.org/web/20190520103547/http://www.espn.com/nfl/","Ravens sign LB Ray, WR Floyd to help fill voids","2019-05-20","Baltimore Ravens"
"http://web.archive.org/web/20190520103547/http://www.espn.com/nfl/","Big Ben hosts Steelers' skill players at lake house","2019-05-20","Pittsburgh Steelers"
"http://web.archive.org/web/20190521110159/http://www.espn.com/nfl/","Bucs 'mutually part ways' with longtime DT McCoy","2019-05-21","Tampa Bay Buccaneers"
"http://web.archive.org/web/20190521110159/http://www.espn.com/nfl/","Big Ben says he went too far criticizing Brown","2019-05-21","Cleveland Browns"
"http://web.archive.org/web/20190521110159/http://www.espn.com/nfl/","Chargers' Bosa switching to family jersey No. 97","2019-05-21","Los Angeles Chargers"
"http://web.archive.org/web/20190523121753/http://www.espn.com/nfl/","Skins sign LB Bostic, officially put Foster on IR","2019-05-23","Washington Football Team"
"http://web.archive.org/web/20190523121753/http://www.espn.com/nfl/","JuJu: Chemistry in Steelers' WR room 'on point'","2019-05-23","Pittsburgh Steelers"
"http://web.archive.org/web/20190523121753/http://www.espn.com/nfl/","Rudolph confirms talks with Vikes on 5-year deal","2019-05-23","Minnesota Vikings"
"http://web.archive.org/web/20190526040155/https://www.espn.com/nfl/","Fournette happy to have 'clean start' with Jags","2019-05-26","Jacksonville Jaguars"
"http://web.archive.org/web/20190527145359/http://www.espn.com/nfl/","Legendary Packers HOF QB Starr dies at 85","2019-05-27","Green Bay Packers"
"http://web.archive.org/web/20190527145359/http://www.espn.com/nfl/","Texans' Watt engaged to soccer player Ohai","2019-05-27","Houston Texans"
"http://web.archive.org/web/20190527145359/http://www.espn.com/nfl/","Court rules against Bucs for BP spill damages","2019-05-27","Tampa Bay Buccaneers"
"http://web.archive.org/web/20190601073849/http://www.espn.com/nfl/","Sources: Packers' LaFleur suffers torn Achilles","2019-06-01","Green Bay Packers"
"http://web.archive.org/web/20190601073849/http://www.espn.com/nfl/","Colts' Kelly gets 2-game ban for October arrest","2019-06-01","Indianapolis Colts"
"http://web.archive.org/web/20190601073849/http://www.espn.com/nfl/","Seahawks sue McDowell, want $800K bonus back","2019-06-01","Seattle Seahawks"
"http://web.archive.org/web/20190601073849/http://www.espn.com/nfl/","Thomas looking good in comeback with Ravens","2019-06-01","Baltimore Ravens"
"http://web.archive.org/web/20190607020711/https://www.espn.com/nfl/","Patriots' Cardona promoted to lieutenant in Navy","2019-06-07","New England Patriots"
"http://web.archive.org/web/20190607020711/https://www.espn.com/nfl/","WR Kearse signs with Lions, reunites with Bevell","2019-06-07","Detroit Lions"
"http://web.archive.org/web/20190607020711/https://www.espn.com/nfl/","Cards claim offensive tackle Harrison off waivers","2019-06-07","Arizona Cardinals"
"http://web.archive.org/web/20190608032237/https://www.espn.com/nfl/","Texans fire GM Brian Gaine after one season","2019-06-08","Houston Texans"
"http://web.archive.org/web/20190608032237/https://www.espn.com/nfl/","COO Demoff: Rams won't rush Goff extension","2019-06-08","Los Angeles Rams"
"http://web.archive.org/web/20190608032237/https://www.espn.com/nfl/","Prosecutors not actively investigating Chiefs' Hill","2019-06-08","Kansas City Chiefs"
"http://web.archive.org/web/20190608032237/https://www.espn.com/nfl/","RB Powell, back from '18 injury, agrees with Jets","2019-06-08","New York Jets"
"http://web.archive.org/web/20190608032237/https://www.espn.com/nfl/","Patriots receive Super Bowl rings, largest ever","2019-06-08","New England Patriots"
"http://web.archive.org/web/20190609041420/https://www.espn.com/nfl/","Sayers gets ovation as Bears' celebration begins","2019-06-09","Chicago Bears"
"http://web.archive.org/web/20190609041420/https://www.espn.com/nfl/","Jets hire Douglas from Eagles as their new GM","2019-06-09","New York Jets"
"http://web.archive.org/web/20190609041420/https://www.espn.com/nfl/","Manziel interested in playing for Houston in XFL","2019-06-09","Houston Texans"
"http://web.archive.org/web/20190609041420/https://www.espn.com/nfl/","Texans fire GM Brian Gaine after one season","2019-06-09","Houston Texans"
"http://web.archive.org/web/20190610042743/https://www.espn.com/nfl/","Sayers gets ovation as Bears' celebration begins","2019-06-10","Chicago Bears"
"http://web.archive.org/web/20190610042743/https://www.espn.com/nfl/","Jets hire Douglas from Eagles as their new GM","2019-06-10","New York Jets"
"http://web.archive.org/web/20190610042743/https://www.espn.com/nfl/","Manziel interested in playing for Houston in XFL","2019-06-10","Houston Texans"
"http://web.archive.org/web/20190610042743/https://www.espn.com/nfl/","Texans fire GM Brian Gaine after one season","2019-06-10","Houston Texans"
"http://web.archive.org/web/20190612052324/https://www.espn.com/nfl/","Sources: Saints, DE Jordan reach $52.5M deal","2019-06-12","New Orleans Saints"
"http://web.archive.org/web/20190612052324/https://www.espn.com/nfl/","Eagles' Jenkins wants new contract at market rate","2019-06-12","Philadelphia Eagles"
"http://web.archive.org/web/20190613060203/https://www.espn.com/nfl/","Cowboys' Cooper focused on football, not contract","2019-06-13","Dallas Cowboys"
"http://web.archive.org/web/20190613060203/https://www.espn.com/nfl/","Source: Pats' Michel sidelined after knee scope","2019-06-13","New England Patriots"
"http://web.archive.org/web/20190613060203/https://www.espn.com/nfl/","Titans retiring numbers of George and McNair","2019-06-13","Tennessee Titans"
"http://web.archive.org/web/20190613060203/https://www.espn.com/nfl/","Bears boot Blewitt, cut number of kickers to 2","2019-06-13","Chicago Bears"
"http://web.archive.org/web/20190614063348/https://www.espn.com/nfl/","Source: Chiefs, PK Butker reach $20M extension","2019-06-14","Kansas City Chiefs"
"http://web.archive.org/web/20190614063348/https://www.espn.com/nfl/","Cardinals release CB Amerson in surprise move","2019-06-14","Arizona Cardinals"
"http://web.archive.org/web/20190614063348/https://www.espn.com/nfl/","Pats pick up another tight end in trade with Lions","2019-06-14","New England Patriots"
"http://web.archive.org/web/20190619022733/http://www.espn.com/nfl/","Packers claim TE Roberts off waivers from Lions","2019-06-19","Green Bay Packers"
"http://web.archive.org/web/20190619022733/http://www.espn.com/nfl/","Broncos to honor Bowlen; won't rename stadium","2019-06-19","Denver Broncos"
"http://web.archive.org/web/20190619022733/http://www.espn.com/nfl/","Jaguars fine LB Smith $88K for missing camp","2019-06-19","Jacksonville Jaguars"
"http://web.archive.org/web/20190621093633/https://www.espn.com/nfl/","Israel honors Pats' Kraft with Genesis Prize","2019-06-21","New England Patriots"
"http://web.archive.org/web/20190621093633/https://www.espn.com/nfl/","McCoy unhappy Bucs quickly gave Suh his No. 93","2019-06-21","Tampa Bay Buccaneers"
"http://web.archive.org/web/20190622024722/https://www.espn.com/nfl/","OBJ: Couldn't reach 'full potential' with Giants","2019-06-22","New York Giants"
"http://web.archive.org/web/20190622024722/https://www.espn.com/nfl/","McCoy unhappy Bucs quickly gave Suh his No. 93","2019-06-22","Tampa Bay Buccaneers"
"http://web.archive.org/web/20190623102519/https://www.espn.com/nfl/","OBJ: Couldn't reach 'full potential' with Giants","2019-06-23","New York Giants"
"http://web.archive.org/web/20190623102519/https://www.espn.com/nfl/","McCoy unhappy Bucs quickly gave Suh his No. 93","2019-06-23","Tampa Bay Buccaneers"
"http://web.archive.org/web/20190626200212/https://www.espn.com/nfl/","Chiefs' Bieniemy: Not playcaller, but has input","2019-06-26","Kansas City Chiefs"
"http://web.archive.org/web/20190626200212/https://www.espn.com/nfl/","Judge OKs $24M settlement over Rams' PSLs","2019-06-26","Los Angeles Rams"
"http://web.archive.org/web/20190627001148/http://www.espn.com/nfl/","Chiefs' Bieniemy: Not playcaller, but has input","2019-06-27","Kansas City Chiefs"
"http://web.archive.org/web/20190627001148/http://www.espn.com/nfl/","Judge OKs $24M settlement over Rams' PSLs","2019-06-27","Los Angeles Rams"
"http://web.archive.org/web/20190629014640/http://www.espn.com/nfl/","Bills' Lawson to pay for 11-year-old's funeral","2019-06-29","Buffalo Bills"
"http://web.archive.org/web/20190629014640/http://www.espn.com/nfl/","Ken Behring, former Seahawks owner, dies at 91","2019-06-29","Seattle Seahawks"
"http://web.archive.org/web/20190629014640/http://www.espn.com/nfl/","Former Seahawks pick McDowell facing charges","2019-06-29","Seattle Seahawks"
"http://web.archive.org/web/20190629014640/http://www.espn.com/nfl/","Source: Chiefs' Hill meets with NFL for 8 hours","2019-06-29","Kansas City Chiefs"
"http://web.archive.org/web/20190629014640/http://www.espn.com/nfl/","Bengals' top pick Williams likely out for season","2019-06-29","Cincinnati Bengals"
"http://web.archive.org/web/20190701035536/http://www.espn.com/nfl/","Source: Saints' Onyemata gets 1-game ban","2019-07-01","New Orleans Saints"
"http://web.archive.org/web/20190701035536/http://www.espn.com/nfl/","KC radio host loses job over remarks about Reid","2019-07-01","Kansas City Chiefs"
"http://web.archive.org/web/20190701035536/http://www.espn.com/nfl/","Bills' Lawson to pay for 11-year-old's funeral","2019-07-01","Buffalo Bills"
"http://web.archive.org/web/20190701035536/http://www.espn.com/nfl/","Ken Behring, former Seahawks owner, dies at 91","2019-07-01","Seattle Seahawks"
"http://web.archive.org/web/20190701035536/http://www.espn.com/nfl/","Former Seahawks pick McDowell facing charges","2019-07-01","Seattle Seahawks"
"http://web.archive.org/web/20190702054432/http://www.espn.com/nfl/","49ers' Goodwin wins '40 Yards of Gold,' $1 million","2019-07-02","San Francisco 49ers"
"http://web.archive.org/web/20190702054432/http://www.espn.com/nfl/","Police use stun gun in arrest of ex-Cowboys DT","2019-07-02","Dallas Cowboys"
"http://web.archive.org/web/20190702054432/http://www.espn.com/nfl/","KC radio host loses job over remarks about Reid","2019-07-02","Kansas City Chiefs"
"http://web.archive.org/web/20190704002217/https://www.espn.com/nfl/","Raiders' Davis: HOFers' families should get rings","2019-07-04","Las Vegas Raiders"
"http://web.archive.org/web/20190705010845/https://www.espn.com/nfl/","No NFL discipline for Elliott in Las Vegas incident","2019-07-05","Las Vegas Raiders"
"http://web.archive.org/web/20190705010845/https://www.espn.com/nfl/","Raiders' Davis: HOFers' families should get rings","2019-07-05","Las Vegas Raiders"
"http://web.archive.org/web/20190709035045/https://www.espn.com/nfl/","Dolphins' Norton has arm amputated after crash","2019-07-09","Miami Dolphins"
"http://web.archive.org/web/20190709035045/https://www.espn.com/nfl/","Raiders' Davis: HOFers' families should get rings","2019-07-09","Las Vegas Raiders"
"http://web.archive.org/web/20190709035045/https://www.espn.com/nfl/","No NFL discipline for Elliott in Las Vegas incident","2019-07-09","Las Vegas Raiders"
"http://web.archive.org/web/20190710011816/http://www.espn.com/nfl/","NFL to cover medical bills for Dolphins' Norton","2019-07-10","Miami Dolphins"
"http://web.archive.org/web/20190710011816/http://www.espn.com/nfl/","Lions' Quin 'walking away' after 10 NFL seasons","2019-07-10","Detroit Lions"
"http://web.archive.org/web/20190710011816/http://www.espn.com/nfl/","Raiders' Brown says he settled balcony incident","2019-07-10","Las Vegas Raiders"
"http://web.archive.org/web/20190711045833/https://www.espn.com/nfl/","Sources: Texans won't hire full-time GM for '19","2019-07-11","Houston Texans"
"http://web.archive.org/web/20190711045833/https://www.espn.com/nfl/","Cards make only pick in NFL supplemental draft","2019-07-11","Arizona Cardinals"
"http://web.archive.org/web/20190712051448/https://www.espn.com/nfl/","Rookie Saints DE sentenced to 6 months in jail","2019-07-12","New Orleans Saints"
"http://web.archive.org/web/20190712051448/https://www.espn.com/nfl/","Browns' Duke Johnson hires agent Rosenhaus","2019-07-12","Cleveland Browns"
"http://web.archive.org/web/20190712051448/https://www.espn.com/nfl/","Ex-Jets head coach, NFL LB Michaels dies at 89","2019-07-12","New York Jets"
"http://web.archive.org/web/20190713052517/http://www.espn.com/nfl/","Raiders' Incognito docked 2 games for conduct","2019-07-13","Las Vegas Raiders"
"http://web.archive.org/web/20190713052517/http://www.espn.com/nfl/","Charges filed in shooting of Giants CB Ballentine","2019-07-13","New York Giants"
"http://web.archive.org/web/20190713052517/http://www.espn.com/nfl/","Rams assistant found not guilty of sexual battery","2019-07-13","Los Angeles Rams"
"http://web.archive.org/web/20190713052517/http://www.espn.com/nfl/","Pack's profit drops 98% due to losing, big deals","2019-07-13","Green Bay Packers"
"http://web.archive.org/web/20190713052517/http://www.espn.com/nfl/","Jets' Herndon suspended 4 games after DWI","2019-07-13","New York Jets"
"http://web.archive.org/web/20190714074351/https://www.espn.com/nfl/","Fins' Caldwell takes medical leave for '19 season","2019-07-14","Miami Dolphins"
"http://web.archive.org/web/20190714074351/https://www.espn.com/nfl/","Pack's profit drops 98% due to losing, big deals","2019-07-14","Green Bay Packers"
"http://web.archive.org/web/20190715060031/https://www.espn.com/nfl/","Fins' Caldwell takes medical leave for '19 season","2019-07-15","Miami Dolphins"
"http://web.archive.org/web/20190716085136/https://www.espn.com/nfl/","Falcons, DT Jarrett beat deadline, reach deal","2019-07-16","Atlanta Falcons"
"http://web.archive.org/web/20190716085136/https://www.espn.com/nfl/","49ers reach deal with K Gould before deadline","2019-07-16","San Francisco 49ers"
"http://web.archive.org/web/20190716085136/https://www.espn.com/nfl/","Bengals G Boling retiring for health reasons","2019-07-16","Cincinnati Bengals"
"http://web.archive.org/web/20190716085136/https://www.espn.com/nfl/","Giants suspend safety Moore following arrest","2019-07-16","New York Giants"
"http://web.archive.org/web/20190718095637/https://www.espn.com/nfl/","Broncos hope their poor QB play ends with Flacco","2019-07-18","Denver Broncos"
"http://web.archive.org/web/20190718095637/https://www.espn.com/nfl/","Cards release Harrison after arrest warrant issued","2019-07-18","Arizona Cardinals"
"http://web.archive.org/web/20190718095637/https://www.espn.com/nfl/","Vikings RB Thomas gets 3-game suspension","2019-07-18","Minnesota Vikings"
"http://web.archive.org/web/20190719104019/https://www.espn.com/nfl/","Chiefs fan fined $500 for flashing laser at Brady","2019-07-19","Kansas City Chiefs"
"http://web.archive.org/web/20190719104019/https://www.espn.com/nfl/","Broncos LB Davis expected to miss 3-4 weeks","2019-07-19","Denver Broncos"
"http://web.archive.org/web/20190720111458/https://www.espn.com/nfl/","Eagles agree to terms to re-sign RB Sproles","2019-07-20","Philadelphia Eagles"
